	Year	Month	Day	Hour	Minute	Aspen	Aspen-Conifer	Conifer1	Conifer2	Conifer3	Aspen	Aspen-Conifer	Conifer1	Conifer2	Conifer3
6/11/19	2019	6	11	0	15	0.033222417	NaN	NaN	NaN	NaN	0.928811932	0.591576954	0	0	0
	2019	6	11	1	15	0.031483913	NaN	NaN	NaN	NaN	0	0	0	0	0
	2019	6	11	2	15	0.030514505	NaN	NaN	NaN	NaN	0	0	0	0	0
	2019	6	11	3	15	0.027184179	NaN	NaN	NaN	NaN	0	0	0	0	0
	2019	6	11	4	15	0.026565544	NaN	NaN	NaN	NaN	0	0	0	0	0
	2019	6	11	5	15	0.026104111	NaN	NaN	NaN	NaN	0	0	0	0	0
	2019	6	11	6	15	0.028179289	NaN	NaN	NaN	NaN	0	0	0	0	0
	2019	6	11	7	15	0.021110418	NaN	NaN	NaN	NaN	0	0	0	0	0
	2019	6	11	8	15	0.019937454	NaN	NaN	NaN	NaN	0	0	0	0	0
	2019	6	11	9	15	0.026518349	NaN	NaN	NaN	NaN	0	0	0	0	0
	2019	6	11	10	15	0.036154236	NaN	NaN	NaN	NaN	0	0	0	0	0
	2019	6	11	11	15	0.041819775	NaN	NaN	NaN	NaN	0	0	0	0	0
	2019	6	11	12	15	0.04492717	NaN	NaN	NaN	NaN	0	0	0	0	0
	2019	6	11	13	15	0.047846002	0.113643144	NaN	NaN	NaN	0	0	0	0	0
	2019	6	11	14	15	0.047162415	0.084830547	NaN	NaN	NaN	0	0	0	0	0
	2019	6	11	15	15	0.048118898	0.08100086	NaN	NaN	NaN	0	0	0	0	0
	2019	6	11	16	15	0.049888612	0.075380618	NaN	NaN	NaN	0	0	0	0	0
	2019	6	11	17	15	0.050987439	0.062745556	NaN	NaN	NaN	0	0	0	0	0
	2019	6	11	18	15	0.053640935	0.055107706	NaN	NaN	NaN	0	0	0	0	0
	2019	6	11	19	15	0.055225747	0.040875931	NaN	NaN	NaN	0	0	0	0	0
	2019	6	11	20	15	0.052032242	0.029986388	NaN	NaN	NaN	0	0	0	0	0
	2019	6	11	21	15	0.046351133	0.020069121	NaN	NaN	NaN	0	0	0	0	0
	2019	6	11	22	15	0.043004659	0.014728145	NaN	NaN	NaN	0	0	0	0	0
	2019	6	11	23	15	0.04083249	0.013208938	NaN	NaN	NaN	0	0	0	0	0
6/12/19	2019	6	12	0	15	0.037247312	0.013447402	NaN	NaN	NaN	1.272531575	1.102295065	0.934326084	0	0
	2019	6	12	1	15	0.036606796	0.013501021	NaN	NaN	NaN	0	0	0	0	0
	2019	6	12	2	15	0.034518019	0.014593237	NaN	NaN	NaN	0	0	0	0	0
	2019	6	12	3	15	0.033672522	0.015028087	NaN	NaN	NaN	0	0	0	0	0
	2019	6	12	4	15	0.030475356	0.015423341	NaN	NaN	NaN	0	0	0	0	0
	2019	6	12	5	15	0.030748674	0.015381795	NaN	NaN	NaN	0	0	0	0	0
	2019	6	12	6	15	0.029847069	0.016051265	NaN	NaN	NaN	0	0	0	0	0
	2019	6	12	7	15	0.024000153	0.034509632	NaN	NaN	NaN	0	0	0	0	0
	2019	6	12	8	15	0.027550979	0.061726379	NaN	NaN	NaN	0	0	0	0	0
	2019	6	12	9	15	0.037994832	0.083272862	NaN	NaN	NaN	0	0	0	0	0
	2019	6	12	10	15	0.051007523	0.084810272	NaN	NaN	NaN	0	0	0	0	0
	2019	6	12	11	15	0.061715875	0.09244263	NaN	NaN	NaN	0	0	0	0	0
	2019	6	12	12	15	0.067136021	0.087304062	NaN	NaN	NaN	0	0	0	0	0
	2019	6	12	13	15	0.069492487	0.082935084	NaN	NaN	NaN	0	0	0	0	0
	2019	6	12	14	15	0.072194024	0.080318285	0.129305752	NaN	NaN	0	0	0	0	0
	2019	6	12	15	15	0.072669144	0.080554829	0.190158454	NaN	NaN	0	0	0	0	0
	2019	6	12	16	15	0.080480338	0.073709834	0.144347556	NaN	NaN	0	0	0	0	0
	2019	6	12	17	15	0.076202565	0.065691164	0.115583358	NaN	NaN	0	0	0	0	0
	2019	6	12	18	15	0.076294128	0.052748926	0.096177768	NaN	NaN	0	0	0	0	0
	2019	6	12	19	15	0.075332964	0.043776162	0.084593025	NaN	NaN	0	0	0	0	0
	2019	6	12	20	15	0.06987064	0.030145103	0.065028681	NaN	NaN	0	0	0	0	0
	2019	6	12	21	15	0.063520189	0.018300278	0.044778967	NaN	NaN	0	0	0	0	0
	2019	6	12	22	15	0.060527139	0.013801058	0.033208388	NaN	NaN	0	0	0	0	0
	2019	6	12	23	15	0.053426826	0.012822357	0.031144135	NaN	NaN	0	0	0	0	0
6/13/19	2019	6	13	0	15	0.049667204	0.012639849	0.029549373	NaN	NaN	1.919734471	1.072126474	2.103586694	0	0.284438247
	2019	6	13	1	15	0.048775787	0.01290383	0.030977511	NaN	NaN	0	0	0	0	0
	2019	6	13	2	15	0.045270834	0.013597243	0.032557346	NaN	NaN	0	0	0	0	0
	2019	6	13	3	15	0.043815934	0.013335436	0.031274421	NaN	NaN	0	0	0	0	0
	2019	6	13	4	15	0.042993834	0.014611975	0.030781516	NaN	NaN	0	0	0	0	0
	2019	6	13	5	15	0.040037053	0.014129725	0.030589993	NaN	NaN	0	0	0	0	0
	2019	6	13	6	15	0.037416531	0.014473409	0.029417149	NaN	NaN	0	0	0	0	0
	2019	6	13	7	15	0.040773376	0.030620404	0.06283939	NaN	NaN	0	0	0	0	0
	2019	6	13	8	15	0.052225123	0.055113938	0.102360861	NaN	NaN	0	0	0	0	0
	2019	6	13	9	15	0.069151025	0.079344413	0.139587521	NaN	NaN	0	0	0	0	0
	2019	6	13	10	15	0.086534618	0.093228628	0.166287615	NaN	NaN	0	0	0	0	0
	2019	6	13	11	15	0.110871863	0.09789091	0.174970158	NaN	NaN	0	0	0	0	0
	2019	6	13	12	15	0.117851033	0.090865356	0.183969331	NaN	NaN	0	0	0	0	0
	2019	6	13	13	15	0.123788039	0.08796628	0.172889194	NaN	NaN	0	0	0	0	0
	2019	6	13	14	15	0.125766177	0.086005335	0.163254401	NaN	0.051789085	0	0	0	0	0
	2019	6	13	15	15	0.121107239	0.071067385	0.143378091	NaN	0.040273381	0	0	0	0	0
	2019	6	13	16	15	0.131614735	0.081414607	0.161426686	NaN	0.050863195	0	0	0	0	0
	2019	6	13	17	15	0.125939651	0.067291319	0.134706232	NaN	0.045584202	0	0	0	0	0
	2019	6	13	18	15	0.123051952	0.055958752	0.110276596	NaN	0.039291125	0	0	0	0	0
	2019	6	13	19	15	0.113480075	0.035601704	0.076289826	NaN	0.024302001	0	0	0	0	0
	2019	6	13	20	15	0.09208903	0.018098827	0.039677006	NaN	0.012609008	0	0	0	0	0
	2019	6	13	21	15	0.075447685	0.012671475	0.025915161	NaN	0.008197021	0	0	0	0	0
	2019	6	13	22	15	0.057126534	0.00760912	0.016361662	NaN	0.006069351	0	0	0	0	0
	2019	6	13	23	15	0.044939139	0.005686554	0.014249654	NaN	0.005459878	0	0	0	0	0
6/14/19	2019	6	14	0	15	0.040913869	0.004851872	0.014712241	NaN	0.006328984	2.220525483	0.950714327	1.95648876	0	0.59970607
	2019	6	14	1	15	0.03913422	0.004612025	0.018846213	NaN	0.007771089	0	0	0	0	0
	2019	6	14	2	15	0.03680569	0.007511554	0.022219367	NaN	0.008043498	0	0	0	0	0
	2019	6	14	3	15	0.033666508	0.00759585	0.022418757	NaN	0.009153406	0	0	0	0	0
	2019	6	14	4	15	0.033237612	0.008736304	0.024631416	NaN	0.008517559	0	0	0	0	0
	2019	6	14	5	15	0.031922135	0.007837929	0.020745961	NaN	0.007327799	0	0	0	0	0
	2019	6	14	6	15	0.030591194	0.008953419	0.020943223	NaN	0.006894658	0	0	0	0	0
	2019	6	14	7	15	0.046891011	0.017817876	0.044201614	NaN	0.011876329	0	0	0	0	0
	2019	6	14	8	15	0.064470496	0.042189761	0.085065231	NaN	0.022520572	0	0	0	0	0
	2019	6	14	9	15	0.089424603	0.065020134	0.122715839	NaN	0.030448665	0	0	0	0	0
	2019	6	14	10	15	0.120514081	0.08674715	0.159266598	NaN	0.044887389	0	0	0	0	0
	2019	6	14	11	15	0.130117019	0.085204939	0.164089824	NaN	0.047631213	0	0	0	0	0
	2019	6	14	12	15	0.1436618	0.077819204	0.160480373	NaN	0.045473812	0	0	0	0	0
	2019	6	14	13	15	0.138138164	0.07576241	0.15315788	NaN	0.045899939	0	0	0	0	0
	2019	6	14	14	15	0.158629001	0.083854637	0.17292585	NaN	0.052080839	0	0	0	0	0
	2019	6	14	15	15	0.148333936	0.070380407	0.141534039	NaN	0.044771393	0	0	0	0	0
	2019	6	14	16	15	0.153914637	0.071733636	0.14203335	NaN	0.045002787	0	0	0	0	0
	2019	6	14	17	15	0.150750288	0.062584007	0.124512616	NaN	0.041547091	0	0	0	0	0
	2019	6	14	18	15	0.145235405	0.05427913	0.109728833	NaN	0.037814375	0	0	0	0	0
	2019	6	14	19	15	0.134531134	0.04075859	0.090460099	NaN	0.028622996	0	0	0	0	0
	2019	6	14	20	15	0.114030288	0.028595771	0.058174961	NaN	0.018757638	0	0	0	0	0
	2019	6	14	21	15	0.092585193	0.017334031	0.035646351	NaN	0.011908195	0	0	0	0	0
	2019	6	14	22	15	0.076443093	0.011317633	0.026132541	NaN	0.008619089	0	0	0	0	0
	2019	6	14	23	15	0.066584106	0.009216058	0.021845583	NaN	0.007806755	0	0	0	0	0
6/15/19	2019	6	15	0	15	0.065391753	0.009845363	0.021118074	NaN	0.007525262	2.385789416	0.975331016	1.909060297	3.235143817	0.607743477
	2019	6	15	1	15	0.057405188	0.010789432	0.023058964	NaN	0.007937919	0	0	0	0	0
	2019	6	15	2	15	0.053479492	0.010444262	0.023402979	NaN	0.008119427	0	0	0	0	0
	2019	6	15	3	15	0.051322994	0.010843188	0.02444984	NaN	0.008022387	0	0	0	0	0
	2019	6	15	4	15	0.049047335	0.010938708	0.023976462	NaN	0.00785302	0	0	0	0	0
	2019	6	15	5	15	0.047330262	0.011871621	0.024516575	NaN	0.007759242	0	0	0	0	0
	2019	6	15	6	15	0.045183564	0.012645061	0.027050566	NaN	0.007763331	0	0	0	0	0
	2019	6	15	7	15	0.063093845	0.026581543	0.054815649	NaN	0.014410466	0	0	0	0	0
	2019	6	15	8	15	0.084553364	0.047994563	0.091717287	NaN	0.022425751	0	0	0	0	0
	2019	6	15	9	15	0.112122063	0.067611347	0.128732358	NaN	0.035347263	0	0	0	0	0
	2019	6	15	10	15	0.126613117	0.081416379	0.150061983	NaN	0.044227579	0	0	0	0	0
	2019	6	15	11	15	0.152259489	0.084835772	0.151274923	NaN	0.044272798	0	0	0	0	0
	2019	6	15	12	15	0.149949739	0.082915144	0.152903106	0.481844352	0.050431424	0	0	0	0	0
	2019	6	15	13	15	0.161132205	0.083656685	0.160998195	0.443729673	0.053004537	0	0	0	0	0
	2019	6	15	14	15	0.168471339	0.083584581	0.160403985	0.44489156	0.053620317	0	0	0	0	0
	2019	6	15	15	15	0.169273492	0.076508587	0.154581266	0.410061405	0.052244973	0	0	0	0	0
	2019	6	15	16	15	0.158006135	0.069187521	0.132033292	0.381378148	0.047444914	0	0	0	0	0
	2019	6	15	17	15	0.143376894	0.052232075	0.104925428	0.295828827	0.035017186	0	0	0	0	0
	2019	6	15	18	15	0.125227792	0.044734273	0.08940945	0.239793322	0.028718543	0	0	0	0	0
	2019	6	15	19	15	0.114969609	0.03682062	0.074206364	0.187825109	0.025742216	0	0	0	0	0
	2019	6	15	20	15	0.089744399	0.024671602	0.050789794	0.133033622	0.018020359	0	0	0	0	0
	2019	6	15	21	15	0.078542077	0.014969959	0.034809537	0.0967721	0.01224643	0	0	0	0	0
	2019	6	15	22	15	0.063225393	0.010991219	0.027574498	0.069729187	0.008252222	0	0	0	0	0
	2019	6	15	23	15	0.056067876	0.009241511	0.022249722	0.050256512	0.007335911	0	0	0	0	0
6/16/19	2019	6	16	0	15	0.049721958	0.008869241	0.020835743	0.042179303	0.007314271	2.668890187	0.96984436	1.870215945	4.528823782	0.622505965
	2019	6	16	1	15	0.045077249	0.008180896	0.019520372	0.03400974	0.007127355	0	0	0	0	0
	2019	6	16	2	15	0.041919615	0.008128685	0.019534949	0.029187717	0.007427395	0	0	0	0	0
	2019	6	16	3	15	0.039059098	0.008372077	0.019994865	0.027187459	0.008300615	0	0	0	0	0
	2019	6	16	4	15	0.040203095	0.009973392	0.02201659	0.028362884	0.008510089	0	0	0	0	0
	2019	6	16	5	15	0.036242014	0.010549922	0.020831401	0.026491305	0.007669715	0	0	0	0	0
	2019	6	16	6	15	0.032710425	0.012271243	0.02056524	0.02501574	0.007974537	0	0	0	0	0
	2019	6	16	7	15	0.054448239	0.021187282	0.044047284	0.03025041	0.012416736	0	0	0	0	0
	2019	6	16	8	15	0.086254161	0.044531398	0.086127189	0.095181943	0.022000256	0	0	0	0	0
	2019	6	16	9	15	0.101881329	0.054240679	0.104314033	0.172932989	0.026863498	0	0	0	0	0
	2019	6	16	10	15	0.151030839	0.082403991	0.139248122	0.327246767	0.037198048	0	0	0	0	0
	2019	6	16	11	15	0.17113402	0.08355466	0.158072043	0.423659699	0.04940897	0	0	0	0	0
	2019	6	16	12	15	0.173230758	0.078553088	0.15042763	0.427676792	0.050010073	0	0	0	0	0
	2019	6	16	13	15	0.182367022	0.075567939	0.147144678	0.409180067	0.048760298	0	0	0	0	0
	2019	6	16	14	15	0.181078567	0.077476814	0.14827106	0.437280879	0.050367748	0	0	0	0	0
	2019	6	16	15	15	0.18679955	0.078233578	0.146938471	0.416545303	0.049295883	0	0	0	0	0
	2019	6	16	16	15	0.192909455	0.080907231	0.146825571	0.420902692	0.051475961	0	0	0	0	0
	2019	6	16	17	15	0.174038371	0.060994424	0.115723298	0.322733288	0.042590104	0	0	0	0	0
	2019	6	16	18	15	0.173554652	0.054095698	0.103034282	0.273202094	0.040746713	0	0	0	0	0
	2019	6	16	19	15	0.154281852	0.036834733	0.075851129	0.202157584	0.03384724	0	0	0	0	0
	2019	6	16	20	15	0.133933258	0.028292828	0.062476176	0.127852841	0.022889028	0	0	0	0	0
	2019	6	16	21	15	0.106075353	0.021285199	0.043936447	0.099104814	0.013978619	0	0	0	0	0
	2019	6	16	22	15	0.087653546	0.014088253	0.029539234	0.07274337	0.009102951	0	0	0	0	0
	2019	6	16	23	15	0.073285761	0.011251109	0.024940138	0.057738102	0.007229862	0	0	0	0	0
6/17/19	2019	6	17	0	15	0.06311478	0.010972019	0.022905818	0.047594059	0.007160278	2.480917867	0.780198342	1.374971937	3.619871785	0.423680291
	2019	6	17	1	15	0.061494221	0.011846966	0.023153109	0.041479619	0.006883197	0	0	0	0	0
	2019	6	17	2	15	0.057077156	0.012766175	0.023247484	0.037528106	0.007049026	0	0	0	0	0
	2019	6	17	3	15	0.050429961	0.012548043	0.018787261	0.031953371	0.00622898	0	0	0	0	0
	2019	6	17	4	15	0.053223584	0.013876283	0.020352868	0.030271432	0.00639288	0	0	0	0	0
	2019	6	17	5	15	0.051475577	0.015040324	0.02130456	0.029304394	0.006903592	0	0	0	0	0
	2019	6	17	6	15	0.053259309	0.017161306	0.024879895	0.032013429	0.007362612	0	0	0	0	0
	2019	6	17	7	15	0.065027407	0.022245177	0.037363709	0.046556435	0.009489953	0	0	0	0	0
	2019	6	17	8	15	0.113269848	0.037467705	0.072025724	0.105237087	0.017872254	0	0	0	0	0
	2019	6	17	9	15	0.171562516	0.061579866	0.117446679	0.229515424	0.027011408	0	0	0	0	0
	2019	6	17	10	15	0.186228502	0.056165126	0.102769679	0.297183493	0.026020492	0	0	0	0	0
	2019	6	17	11	15	0.133991112	0.040613731	0.067867705	0.21830017	0.017396551	0	0	0	0	0
	2019	6	17	12	15	0.14081735	0.031986168	0.056795293	0.18568522	0.015463542	0	0	0	0	0
	2019	6	17	13	15	0.200251409	0.071181687	0.126029758	0.44436138	0.037722295	0	0	0	0	0
	2019	6	17	14	15	0.172258634	0.0688547	0.122611054	0.382980801	0.036745765	0	0	0	0	0
	2019	6	17	15	15	0.142630176	0.058245591	0.1073168	0.324031022	0.03756245	0	0	0	0	0
	2019	6	17	16	15	0.130660165	0.042727323	0.082311547	0.233755969	0.028566443	0	0	0	0	0
	2019	6	17	17	15	0.11805647	0.042618876	0.077629791	0.217588269	0.026554438	0	0	0	0	0
	2019	6	17	18	15	0.10700874	0.034229591	0.065237795	0.179718421	0.022040064	0	0	0	0	0
	2019	6	17	19	15	0.105845824	0.029871805	0.052192379	0.158472594	0.022782912	0	0	0	0	0
	2019	6	17	20	15	0.094526079	0.027581869	0.045487489	0.123185881	0.019862234	0	0	0	0	0
	2019	6	17	21	15	0.092746687	0.024331622	0.043117822	0.106061663	0.015983887	0	0	0	0	0
	2019	6	17	22	15	0.064694864	0.019425072	0.026648774	0.070311284	0.009015912	0	0	0	0	0
	2019	6	17	23	15	0.051267496	0.016861317	0.017488944	0.046782262	0.005609126	0	0	0	0	0
6/18/19	2019	6	18	0	15	0.037834761	0.015583946	0.013267002	0.032029625	0.004471448	1.186320137	0.609758906	0.619373313	1.784604182	0.210509564
	2019	6	18	1	15	0.038571563	0.01609248	0.013320109	0.026376322	0.004138166	0	0	0	0	0
	2019	6	18	2	15	0.032533881	0.015428066	0.012943606	0.023948992	0.003804778	0	0	0	0	0
	2019	6	18	3	15	0.027875668	0.015862029	0.011863843	0.021787063	0.004016631	0	0	0	0	0
	2019	6	18	4	15	0.026779544	0.015525045	0.010246853	0.018330691	0.003376067	0	0	0	0	0
	2019	6	18	5	15	0.024894898	0.015620837	0.009425526	0.015899853	0.003492569	0	0	0	0	0
	2019	6	18	6	15	0.024298809	0.015382832	0.009775361	0.017181387	0.004129168	0	0	0	0	0
	2019	6	18	7	15	0.026504621	0.01623753	0.010967565	0.018784521	0.006900319	0	0	0	0	0
	2019	6	18	8	15	0.051106828	0.023838934	0.030148618	0.061504156	0.012183271	0	0	0	0	0
	2019	6	18	9	15	0.060595542	0.033078126	0.044764554	0.117268742	0.016072147	0	0	0	0	0
	2019	6	18	10	15	0.090463475	0.042608232	0.066621783	0.217238206	0.025194743	0	0	0	0	0
	2019	6	18	11	15	0.091733967	0.044668485	0.061295505	0.196881353	0.020448627	0	0	0	0	0
	2019	6	18	12	15	0.110705636	0.056014109	0.088747029	0.273202374	0.029135259	0	0	0	0	0
	2019	6	18	13	15	0.085057291	0.047023298	0.070733573	0.219632143	0.020914543	0	0	0	0	0
	2019	6	18	14	15	0.068542589	0.026009964	0.02769421	0.104926854	0.008775878	0	0	0	0	0
	2019	6	18	15	15	0.08860675	0.030690875	0.033180197	0.125233999	0.008044358	0	0	0	0	0
	2019	6	18	16	15	0.064195902	0.028518895	0.022393774	0.085308422	0.00569478	0	0	0	0	0
	2019	6	18	17	15	0.05717368	0.030076057	0.026768348	0.077450877	0.00760612	0	0	0	0	0
	2019	6	18	18	15	0.042575	0.025086331	0.01873868	0.055482434	0.005549168	0	0	0	0	0
	2019	6	18	19	15	0.033065712	0.020837147	0.011716171	0.034213049	0.004800838	0	0	0	0	0
	2019	6	18	20	15	0.030014882	0.019051101	0.007428639	0.019315133	0.003663903	0	0	0	0	0
	2019	6	18	21	15	0.026326999	0.018993971	0.006013895	0.010247452	0.002918613	0	0	0	0	0
	2019	6	18	22	15	0.022789554	0.018949244	0.005731736	0.006229728	0.002786126	0	0	0	0	0
	2019	6	18	23	15	0.024072585	0.018581372	0.005586736	0.006130806	0.002392044	0	0	0	0	0
6/19/19	2019	6	19	0	15	0.022032604	0.018672084	0.005193839	0.006091919	0.002121422	3.295055086	1.052348976	1.587253629	3.967689373	0.547109227
	2019	6	19	1	15	0.021419338	0.019417064	0.005094507	0.005321716	0.002139336	0	0	0	0	0
	2019	6	19	2	15	0.020023052	0.019119573	0.004895438	0.005262339	0.002201039	0	0	0	0	0
	2019	6	19	3	15	0.019168772	0.019962067	0.004781381	0.004566229	0.002351738	0	0	0	0	0
	2019	6	19	4	15	0.019720934	0.019906117	0.004915775	0.004551617	0.002235268	0	0	0	0	0
	2019	6	19	5	15	0.017126158	0.020214998	0.005640923	0.000926484	0.003298198	0	0	0	0	0
	2019	6	19	6	15	0.016367878	0.020440572	0.008736749	0.003774203	0.004331933	0	0	0	0	0
	2019	6	19	7	15	0.017378129	0.019214187	0.01233303	0.002320677	0.005036535	0	0	0	0	0
	2019	6	19	8	15	0.043702221	0.024144011	0.026961027	0.022219667	0.006766273	0	0	0	0	0
	2019	6	19	9	15	0.118184803	0.038864105	0.053137707	0.062730693	0.015735282	0	0	0	0	0
	2019	6	19	10	15	0.235372031	0.082495566	0.104745726	0.123572229	0.025670131	0	0	0	0	0
	2019	6	19	11	15	0.24413737	0.080921467	0.122887312	0.224785535	0.037490378	0	0	0	0	0
	2019	6	19	12	15	0.265613239	0.084555857	0.138139094	0.394811579	0.044698327	0	0	0	0	0
	2019	6	19	13	15	0.281904803	0.082783862	0.147306988	0.47440689	0.049271676	0	0	0	0	0
	2019	6	19	14	15	0.267381355	0.077676136	0.141154187	0.461947488	0.049808214	0	0	0	0	0
	2019	6	19	15	15	0.243135697	0.072145613	0.13348926	0.415614632	0.0487334	0	0	0	0	0
	2019	6	19	16	15	0.242554989	0.071147733	0.134357857	0.40701947	0.047161738	0	0	0	0	0
	2019	6	19	17	15	0.239356238	0.069236103	0.12857727	0.375682928	0.049953221	0	0	0	0	0
	2019	6	19	18	15	0.222827358	0.053525888	0.099516887	0.317907922	0.042658419	0	0	0	0	0
	2019	6	19	19	15	0.201495081	0.040167992	0.084721668	0.23189395	0.035875625	0	0	0	0	0
	2019	6	19	20	15	0.161293335	0.03326226	0.072739906	0.158391321	0.025433094	0	0	0	0	0
	2019	6	19	21	15	0.140335313	0.0292768	0.060018374	0.110221352	0.01823318	0	0	0	0	0
	2019	6	19	22	15	0.123163473	0.027679573	0.046897877	0.088139993	0.013918242	0	0	0	0	0
	2019	6	19	23	15	0.111360915	0.027519348	0.041010847	0.06552854	0.011986558	0	0	0	0	0
6/20/19	2019	6	20	0	15	0.097692947	0.028791328	0.038214933	0.051001396	0.011524023	5.007426628	1.280592807	2.236606477	5.321356214	0.7406759
	2019	6	20	1	15	0.104209988	0.030331174	0.041370283	0.060186724	0.012120762	0	0	0	0	0
	2019	6	20	2	15	0.114571777	0.033946706	0.050718675	0.079320226	0.013465293	0	0	0	0	0
	2019	6	20	3	15	0.095227591	0.035348759	0.047821741	0.067204385	0.01416023	0	0	0	0	0
	2019	6	20	4	15	0.100142847	0.034147388	0.04764982	0.060385573	0.015310544	0	0	0	0	0
	2019	6	20	5	15	0.100356745	0.036283983	0.052293686	0.054419309	0.015350848	0	0	0	0	0
	2019	6	20	6	15	0.105878699	0.039451978	0.061136826	0.056911393	0.017011294	0	0	0	0	0
	2019	6	20	7	15	0.220517123	0.055159709	0.099677232	0.117458775	0.02828902	0	0	0	0	0
	2019	6	20	8	15	0.327881065	0.077678284	0.135369609	0.284106607	0.040198686	0	0	0	0	0
	2019	6	20	9	15	0.349334876	0.087337247	0.144112558	0.398536153	0.048014107	0	0	0	0	0
	2019	6	20	10	15	0.368967289	0.09145478	0.151075138	0.44264766	0.052855249	0	0	0	0	0
	2019	6	20	11	15	0.361213664	0.096711992	0.158806916	0.476017597	0.054708733	0	0	0	0	0
	2019	6	20	12	15	0.353479055	0.087494779	0.155588668	0.469697188	0.054259194	0	0	0	0	0
	2019	6	20	13	15	0.357625061	0.09072647	0.161282302	0.532573344	0.054564913	0	0	0	0	0
	2019	6	20	14	15	0.326305181	0.084856325	0.158823842	0.47820456	0.054127675	0	0	0	0	0
	2019	6	20	15	15	0.287841941	0.068945489	0.129951204	0.370001556	0.045740553	0	0	0	0	0
	2019	6	20	16	15	0.205815574	0.044922208	0.094900249	0.23875304	0.035922391	0	0	0	0	0
	2019	6	20	17	15	0.248256266	0.063868235	0.113555329	0.279629755	0.045232769	0	0	0	0	0
	2019	6	20	18	15	0.199196636	0.048716445	0.096983172	0.224444186	0.03414507	0	0	0	0	0
	2019	6	20	19	15	0.157137817	0.033622406	0.076162327	0.174771619	0.023368928	0	0	0	0	0
	2019	6	20	20	15	0.138838961	0.032282038	0.071025709	0.145275484	0.021037684	0	0	0	0	0
	2019	6	20	21	15	0.12215949	0.026906368	0.053457893	0.108280607	0.01826648	0	0	0	0	0
	2019	6	20	22	15	0.131939653	0.025118581	0.049297887	0.078568519	0.016015006	0	0	0	0	0
	2019	6	20	23	15	0.132836382	0.026490135	0.047330478	0.072960558	0.014986448	0	0	0	0	0
6/21/19	2019	6	21	0	15	0.132398793	0.029393544	0.048973419	0.07757123	0.014413841	4.779452135	1.179325231	1.982486013	5.246001849	0.685785951
	2019	6	21	1	15	0.12572686	0.028188047	0.045511064	0.074357652	0.013469257	0	0	0	0	0
	2019	6	21	2	15	0.129317125	0.028582376	0.045288108	0.073677609	0.013281411	0	0	0	0	0
	2019	6	21	3	15	0.112706687	0.02399036	0.037885843	0.060226418	0.012158174	0	0	0	0	0
	2019	6	21	4	15	0.107719201	0.021027241	0.032782412	0.052414339	0.01126415	0	0	0	0	0
	2019	6	21	5	15	0.112307492	0.022629785	0.030709854	0.049792339	0.010464595	0	0	0	0	0
	2019	6	21	6	15	0.099657067	0.02445173	0.032087641	0.061232518	0.01007998	0	0	0	0	0
	2019	6	21	7	15	0.118061481	0.032508403	0.047140654	0.075078557	0.015001603	0	0	0	0	0
	2019	6	21	8	15	0.155401693	0.043731755	0.069730872	0.140800295	0.020928194	0	0	0	0	0
	2019	6	21	9	15	0.346506754	0.062869162	0.10201203	0.272592747	0.030510671	0	0	0	0	0
	2019	6	21	10	15	0.28512577	0.076281594	0.122713338	0.376490647	0.039230153	0	0	0	0	0
	2019	6	21	11	15	0.28229964	0.084176848	0.138803008	0.445787851	0.047052916	0	0	0	0	0
	2019	6	21	12	15	0.346335411	0.081911186	0.141581235	0.43210195	0.046840423	0	0	0	0	0
	2019	6	21	13	15	0.308068619	0.082961653	0.139759558	0.443739609	0.04746252	0	0	0	0	0
	2019	6	21	14	15	0.302038541	0.086727216	0.147411537	0.458034498	0.052076184	0	0	0	0	0
	2019	6	21	15	15	0.283535205	0.08303951	0.146249211	0.447333149	0.052366946	0	0	0	0	0
	2019	6	21	16	15	0.308013319	0.08458649	0.146864143	0.432449494	0.054466085	0	0	0	0	0
	2019	6	21	17	15	0.286463682	0.074937468	0.129171956	0.363481737	0.049419751	0	0	0	0	0
	2019	6	21	18	15	0.260866677	0.062324871	0.105593237	0.301224843	0.043059617	0	0	0	0	0
	2019	6	21	19	15	0.225375932	0.045857928	0.083519324	0.215171588	0.036208118	0	0	0	0	0
	2019	6	21	20	15	0.169795842	0.039196263	0.072991514	0.149838286	0.027112698	0	0	0	0	0
	2019	6	21	21	15	0.125147607	0.028282857	0.054722706	0.111913529	0.017929397	0	0	0	0	0
	2019	6	21	22	15	0.085640844	0.017840023	0.035213306	0.075854534	0.011790171	0	0	0	0	0
	2019	6	21	23	15	0.070941893	0.013828921	0.025770043	0.05483643	0.009199096	0	0	0	0	0
6/22/19	2019	6	22	0	15	0.072651952	0.01557826	0.029433423	0.050070916	0.008888538	1.979903263	0.359226037	0.848801663	1.376233185	0.163144497
	2019	6	22	1	15	0.072084336	0.016534558	0.029730258	0.050388135	0.007958415	0	0	0	0	0
	2019	6	22	2	15	0.060887823	0.014869889	0.024916966	0.044781827	0.007180496	0	0	0	0	0
	2019	6	22	3	15	0.061627507	0.012169474	0.020655311	0.041270184	0.00578902	0	0	0	0	0
	2019	6	22	4	15	0.047018725	0.007502712	0.016476847	0.026965462	0.003848192	0	0	0	0	0
	2019	6	22	5	15	0.038992013	0.004417839	0.015442024	0.01601459	0.002224615	0	0	0	0	0
	2019	6	22	6	15	0.034406618	0.003826284	0.015751769	0.014139398	0.001880715	0	0	0	0	0
	2019	6	22	7	15	0.029327208	0.002396351	0.016850439	0.010752152	0.002220368	0	0	0	0	0
	2019	6	22	8	15	0.037843238	0.002209925	0.019328156	0.013595082	0.004858595	0	0	0	0	0
	2019	6	22	9	15	0.092179112	0.006685671	0.027848104	0.030138617	0.003280767	0	0	0	0	0
	2019	6	22	10	15	0.213604741	0.02950135	0.061560056	0.066393734	0.007971885	0	0	0	0	0
	2019	6	22	11	15	0.244022465	0.056755214	0.096401028	0.152827881	0.013366167	0	0	0	0	0
	2019	6	22	12	15	0.27152308	0.068648571	0.114233282	0.317250339	0.026185558	0	0	0	0	0
	2019	6	22	13	15	0.227952778	0.058918652	0.099523308	0.29375107	0.029441523	0	0	0	0	0
	2019	6	22	14	15	0.117126475	0.024798361	0.054657702	0.13584678	0.014380286	0	0	0	0	0
	2019	6	22	15	15	0.074985825	0.009294808	0.031838197	0.058120737	0.006359853	0	0	0	0	0
	2019	6	22	16	15	0.059275815	0.007451223	0.02764388	0.029564042	0.004620662	0	0	0	0	0
	2019	6	22	17	15	0.046541438	0.005178502	0.024872478	0.014337085	0.003091399	0	0	0	0	0
	2019	6	22	18	15	0.039602498	0.004763971	0.023401443	0.010428387	0.002320192	0	0	0	0	0
	2019	6	22	19	15	0.032398333	0.002407062	0.021965921	0.009438709	0.002272094	0	0	0	0	0
	2019	6	22	20	15	0.029609157	0.001931936	0.020950885	0.010040343	0.002186407	0	0	0	0	0
	2019	6	22	21	15	0.026354364	0.001757766	0.02035529	-0.00608113	0.000372745	0	0	0	0	0
	2019	6	22	22	15	0.026444867	0.000723885	0.017405224	-0.009181668	0.001291874	0	0	0	0	0
	2019	6	22	23	15	0.023442895	0.000903773	0.017559672	-0.004619487	0.001154131	0	0	0	0	0
6/23/19	2019	6	23	0	15	0.016500679	0.000469533	0.016465645	-0.004300757	0.001110758	1.352631872	0.405341734	0.693470754	0.81046942	0.169848247
	2019	6	23	1	15	0.036441734	0.000691699	0.016057071	-0.004133925	0.001443023	0	0	0	0	0
	2019	6	23	2	15	0.027355254	0.002298866	0.014216921	-0.004997794	0.001624143	0	0	0	0	0
	2019	6	23	3	15	0.027164834	0.002810285	0.013825798	0.00320991	0.002239295	0	0	0	0	0
	2019	6	23	4	15	0.025473493	0.002286355	0.014799558	0.0040396	0.002780917	0	0	0	0	0
	2019	6	23	5	15	0.020596677	0.002700054	0.015023909	0.007162322	0.002560873	0	0	0	0	0
	2019	6	23	6	15	0.012035514	0.002054363	0.014284077	-0.003998963	0.002436498	0	0	0	0	0
	2019	6	23	7	15	0.009911816	0.001925752	0.014527659	0.002115907	0.003629128	0	0	0	0	0
	2019	6	23	8	15	-0.012509593	-0.003135481	0.011100985	-0.006910333	0.0030695	0	0	0	0	0
	2019	6	23	9	15	0.007144012	0.001563915	0.006197626	-0.003568102	0.003376025	0	0	0	0	0
	2019	6	23	10	15	0.06174965	0.020635431	0.016606663	-0.022873375	0.004440292	0	0	0	0	0
	2019	6	23	11	15	0.083771724	0.026311294	0.022741834	-0.022130682	0.001897555	0	0	0	0	0
	2019	6	23	12	15	0.118339362	0.036729506	0.032297533	0.008111833	0.004891986	0	0	0	0	0
	2019	6	23	13	15	0.121488725	0.039247316	0.0447396	0.032109097	0.005897464	0	0	0	0	0
	2019	6	23	14	15	0.101721807	0.034341104	0.045992262	0.056313769	0.008022004	0	0	0	0	0
	2019	6	23	15	15	0.104922508	0.03870459	0.066179733	0.111327839	0.013874819	0	0	0	0	0
	2019	6	23	16	15	0.076881735	0.029038182	0.047405221	0.09394466	0.012921851	0	0	0	0	0
	2019	6	23	17	15	0.099178772	0.040445938	0.063962933	0.142992412	0.021955588	0	0	0	0	0
	2019	6	23	18	15	0.106920672	0.040333497	0.064144073	0.157054645	0.022768836	0	0	0	0	0
	2019	6	23	19	15	0.080529524	0.027750784	0.04654624	0.110921867	0.016529155	0	0	0	0	0
	2019	6	23	20	15	0.063231305	0.019241738	0.034335536	0.074347844	0.011887692	0	0	0	0	0
	2019	6	23	21	15	0.058274434	0.015308634	0.028694666	0.047967042	0.008710694	0	0	0	0	0
	2019	6	23	22	15	0.054164283	0.012571118	0.022992545	0.02447928	0.006384521	0	0	0	0	0
	2019	6	23	23	15	0.051342951	0.011017261	0.020332666	0.007285324	0.00539563	0	0	0	0	0
6/24/19	2019	6	24	0	15	0.047313914	0.010275851	0.018997772	-0.002468978	0.005005935	3.322120121	0.949830014	1.838814579	3.689047926	0.515402984
	2019	6	24	1	15	0.041446714	0.009931536	0.021236566	-0.001829744	0.005268734	0	0	0	0	0
	2019	6	24	2	15	0.04109384	0.01052354	0.02854088	-0.000814644	0.005464723	0	0	0	0	0
	2019	6	24	3	15	0.039088201	0.011086564	0.035407027	-0.000708487	0.005592671	0	0	0	0	0
	2019	6	24	4	15	0.037378571	0.011563949	0.042306407	0.001641751	0.005847291	0	0	0	0	0
	2019	6	24	5	15	0.033790883	0.011714025	0.049869528	-0.00183586	0.006036895	0	0	0	0	0
	2019	6	24	6	15	0.031323209	0.011513965	0.055488187	0.018665637	0.006413034	0	0	0	0	0
	2019	6	24	7	15	0.042784346	0.016718609	0.068866075	0.054576002	0.008636983	0	0	0	0	0
	2019	6	24	8	15	0.061941821	0.027946196	0.088916083	0.099727107	0.014997633	0	0	0	0	0
	2019	6	24	9	15	0.123931491	0.049655407	0.108202508	0.17252377	0.021998972	0	0	0	0	0
	2019	6	24	10	15	0.217852674	0.073783967	0.123871147	0.230834961	0.032083028	0	0	0	0	0
	2019	6	24	11	15	0.298552584	0.082104414	0.13358839	0.306223762	0.040266708	0	0	0	0	0
	2019	6	24	12	15	0.283458437	0.078927114	0.139119783	0.360144453	0.042954729	0	0	0	0	0
	2019	6	24	13	15	0.275106981	0.077028073	0.140292504	0.42498088	0.041558101	0	0	0	0	0
	2019	6	24	14	15	0.258654649	0.072431485	0.129225102	0.427170982	0.043457996	0	0	0	0	0
	2019	6	24	15	15	0.237668457	0.071984675	0.12725264	0.387410543	0.041952491	0	0	0	0	0
	2019	6	24	16	15	0.230976954	0.069895354	0.115759811	0.335184726	0.040281144	0	0	0	0	0
	2019	6	24	17	15	0.213576554	0.063550264	0.101470869	0.254736425	0.038486054	0	0	0	0	0
	2019	6	24	18	15	0.199508997	0.053403448	0.085270276	0.211453005	0.034172016	0	0	0	0	0
	2019	6	24	19	15	0.177062998	0.039927654	0.068600823	0.163464403	0.026664382	0	0	0	0	0
	2019	6	24	20	15	0.136764092	0.031628396	0.054918945	0.106110913	0.019155324	0	0	0	0	0
	2019	6	24	21	15	0.113429929	0.026172645	0.042979566	0.064862653	0.012760393	0	0	0	0	0
	2019	6	24	22	15	0.095624248	0.020339344	0.03148611	0.044050121	0.008850904	0	0	0	0	0
	2019	6	24	23	15	0.083789577	0.017723539	0.02714758	0.032943545	0.007496843	0	0	0	0	0
6/25/19	2019	6	25	0	15	0.076501003	0.017363871	0.02718892	0.029789177	0.007133624	4.531228495	1.176090752	1.986179177	4.506874269	0.605905242
	2019	6	25	1	15	0.07169323	0.018162695	0.029438403	0.032651981	0.00726954	0	0	0	0	0
	2019	6	25	2	15	0.068836282	0.019518572	0.03118239	0.033806093	0.007552475	0	0	0	0	0
	2019	6	25	3	15	0.066672447	0.019480373	0.031233338	0.034126849	0.007633397	0	0	0	0	0
	2019	6	25	4	15	0.064251046	0.018689499	0.034040196	0.033447014	0.008144597	0	0	0	0	0
	2019	6	25	5	15	0.065209967	0.017934128	0.040946817	0.033646591	0.008396998	0	0	0	0	0
	2019	6	25	6	15	0.064919552	0.017847209	0.047235313	0.041563386	0.008367966	0	0	0	0	0
	2019	6	25	7	15	0.112417604	0.029857924	0.074530015	0.053645687	0.014263548	0	0	0	0	0
	2019	6	25	8	15	0.229313848	0.057593445	0.108661101	0.133092457	0.024537909	0	0	0	0	0
	2019	6	25	9	15	0.300476383	0.075016348	0.126936959	0.257471302	0.032736832	0	0	0	0	0
	2019	6	25	10	15	0.347508747	0.092872373	0.14075196	0.374333869	0.044480403	0	0	0	0	0
	2019	6	25	11	15	0.33916009	0.094584844	0.154537831	0.437344185	0.049222839	0	0	0	0	0
	2019	6	25	12	15	0.350906665	0.092633326	0.160219702	0.444170389	0.050738221	0	0	0	0	0
	2019	6	25	13	15	0.342575479	0.092227228	0.155739911	0.448030527	0.051527716	0	0	0	0	0
	2019	6	25	14	15	0.345433657	0.095223073	0.16008297	0.463133316	0.054379492	0	0	0	0	0
	2019	6	25	15	15	0.33626119	0.092286506	0.151407651	0.429481077	0.0523408	0	0	0	0	0
	2019	6	25	16	15	0.311805324	0.082561869	0.125933741	0.362359571	0.045839608	0	0	0	0	0
	2019	6	25	17	15	0.232014879	0.063731077	0.095355587	0.257417477	0.035717617	0	0	0	0	0
	2019	6	25	18	15	0.19751345	0.049927893	0.080746707	0.209056178	0.026626301	0	0	0	0	0
	2019	6	25	19	15	0.164668294	0.039926527	0.067590719	0.151402961	0.022484098	0	0	0	0	0
	2019	6	25	20	15	0.136368988	0.032196694	0.052615484	0.102627724	0.017789287	0	0	0	0	0
	2019	6	25	21	15	0.110806857	0.023098435	0.037908792	0.063666688	0.012537416	0	0	0	0	0
	2019	6	25	22	15	0.103294448	0.017867788	0.027851996	0.045214262	0.008661118	0	0	0	0	0
	2019	6	25	23	15	0.092619065	0.015489055	0.024042674	0.035395508	0.00752344	0	0	0	0	0
6/26/19	2019	6	26	0	15	0.082670612	0.014286638	0.022846445	0.029679793	0.007713449	5.356944781	1.283515482	1.937270098	4.712329873	0.678351274
	2019	6	26	1	15	0.081294603	0.01448253	0.023206794	0.027317248	0.007646483	0	0	0	0	0
	2019	6	26	2	15	0.079355149	0.015105569	0.024553348	0.02914245	0.00798012	0	0	0	0	0
	2019	6	26	3	15	0.081116124	0.016070883	0.026062249	0.031663039	0.008652012	0	0	0	0	0
	2019	6	26	4	15	0.082930454	0.016905647	0.028060754	0.035412742	0.009501677	0	0	0	0	0
	2019	6	26	5	15	0.083535251	0.017573557	0.029252871	0.036321752	0.010206722	0	0	0	0	0
	2019	6	26	6	15	0.088873718	0.018802217	0.030700318	0.046202336	0.010769083	0	0	0	0	0
	2019	6	26	7	15	0.188077698	0.036256778	0.065825341	0.057751663	0.02018993	0	0	0	0	0
	2019	6	26	8	15	0.309314008	0.071071445	0.11447936	0.153575783	0.031296945	0	0	0	0	0
	2019	6	26	9	15	0.337835195	0.082731537	0.133251005	0.312839693	0.04317507	0	0	0	0	0
	2019	6	26	10	15	0.370367845	0.099776116	0.155964118	0.401053156	0.049338436	0	0	0	0	0
	2019	6	26	11	15	0.383122085	0.106921195	0.169007774	0.467567339	0.053373625	0	0	0	0	0
	2019	6	26	12	15	0.385369842	0.105000426	0.161777078	0.450893336	0.052136577	0	0	0	0	0
	2019	6	26	13	15	0.372122141	0.10130275	0.151238048	0.457441836	0.05086902	0	0	0	0	0
	2019	6	26	14	15	0.341120637	0.095750579	0.138419689	0.442002201	0.050637071	0	0	0	0	0
	2019	6	26	15	15	0.329903652	0.091835797	0.132505209	0.388859259	0.048473872	0	0	0	0	0
	2019	6	26	16	15	0.328236157	0.09209403	0.13154049	0.36765737	0.049182246	0	0	0	0	0
	2019	6	26	17	15	0.305314842	0.080197523	0.105507595	0.2825608	0.044666961	0	0	0	0	0
	2019	6	26	18	15	0.280705008	0.063080397	0.081948744	0.235103618	0.038648196	0	0	0	0	0
	2019	6	26	19	15	0.247709823	0.045498738	0.064273897	0.177673331	0.030547247	0	0	0	0	0
	2019	6	26	20	15	0.190698011	0.035088842	0.054299512	0.120968639	0.021617602	0	0	0	0	0
	2019	6	26	21	15	0.156188016	0.026146482	0.039006868	0.071149186	0.01362546	0	0	0	0	0
	2019	6	26	22	15	0.13572314	0.020352273	0.029690064	0.050427742	0.009624047	0	0	0	0	0
	2019	6	26	23	15	0.11536077	0.017183533	0.023852527	0.039065561	0.008479423	0	0	0	0	0
6/27/19	2019	6	27	0	15	0.10726108	0.01627211	0.023267978	0.033713727	0.007926144	5.55642687	1.293949077	1.90463807	4.654076312	0.657707741
	2019	6	27	1	15	0.104959998	0.01587921	0.022918121	0.031598722	0.008133653	0	0	0	0	0
	2019	6	27	2	15	0.100094036	0.015797075	0.023159169	0.033842338	0.007923789	0	0	0	0	0
	2019	6	27	3	15	0.099621663	0.01662711	0.024948103	0.035596326	0.008795867	0	0	0	0	0
	2019	6	27	4	15	0.098538013	0.017777724	0.028727283	0.039186036	0.009386831	0	0	0	0	0
	2019	6	27	5	15	0.104739304	0.019390189	0.030663341	0.038191785	0.009631898	0	0	0	0	0
	2019	6	27	6	15	0.104083735	0.022688563	0.035555367	0.053114566	0.010756136	0	0	0	0	0
	2019	6	27	7	15	0.19501219	0.047176404	0.074339291	0.073421228	0.020960307	0	0	0	0	0
	2019	6	27	8	15	0.35514721	0.080458811	0.123340582	0.214831908	0.033156948	0	0	0	0	0
	2019	6	27	9	15	0.344034708	0.082889121	0.128874237	0.304248814	0.039623398	0	0	0	0	0
	2019	6	27	10	15	0.317502688	0.083486126	0.128395192	0.35065397	0.041192389	0	0	0	0	0
	2019	6	27	11	15	0.398096068	0.106942892	0.156400676	0.444949912	0.050972368	0	0	0	0	0
	2019	6	27	12	15	0.3618629	0.100380364	0.147941796	0.434592809	0.050207775	0	0	0	0	0
	2019	6	27	13	15	0.389169302	0.104659623	0.148047513	0.451562292	0.047632803	0	0	0	0	0
	2019	6	27	14	15	0.358040945	0.099872669	0.143100347	0.432777585	0.050555878	0	0	0	0	0
	2019	6	27	15	15	0.338503841	0.092460265	0.133994989	0.380772335	0.048252024	0	0	0	0	0
	2019	6	27	16	15	0.295919711	0.08046747	0.116989791	0.323330908	0.041597089	0	0	0	0	0
	2019	6	27	17	15	0.309100159	0.081797471	0.111068662	0.286619071	0.045318507	0	0	0	0	0
	2019	6	27	18	15	0.299051551	0.065916092	0.085352947	0.248703394	0.039969952	0	0	0	0	0
	2019	6	27	19	15	0.257809726	0.044061668	0.062991949	0.169299379	0.03116896	0	0	0	0	0
	2019	6	27	20	15	0.198364859	0.034617119	0.054008502	0.10450931	0.021507013	0	0	0	0	0
	2019	6	27	21	15	0.160225128	0.026797732	0.041554574	0.07356219	0.014007305	0	0	0	0	0
	2019	6	27	22	15	0.138324762	0.020059783	0.031053558	0.052280488	0.009972488	0	0	0	0	0
	2019	6	27	23	15	0.120963293	0.017473486	0.027944102	0.042717219	0.009058219	0	0	0	0	0
6/28/19	2019	6	28	0	15	0.108898054	0.01672913	0.026014501	0.039547443	0.008909518	6.018882943	1.439554484	1.961425807	4.930561597	0.669657865
	2019	6	28	1	15	0.106047514	0.016192342	0.025565844	0.038191732	0.008345684	0	0	0	0	0
	2019	6	28	2	15	0.097961443	0.016083325	0.026401026	0.036503339	0.008527411	0	0	0	0	0
	2019	6	28	3	15	0.097570845	0.016196129	0.027263416	0.037013655	0.008786979	0	0	0	0	0
	2019	6	28	4	15	0.096579444	0.016673862	0.028360416	0.037166691	0.009127337	0	0	0	0	0
	2019	6	28	5	15	0.092978401	0.017738826	0.031547439	0.03906417	0.009371194	0	0	0	0	0
	2019	6	28	6	15	0.106930155	0.019104206	0.032917039	0.051498819	0.011427698	0	0	0	0	0
	2019	6	28	7	15	0.237753398	0.045199616	0.079896103	0.072916733	0.022394914	0	0	0	0	0
	2019	6	28	8	15	0.380351495	0.084843244	0.123889387	0.18082152	0.033579199	0	0	0	0	0
	2019	6	28	9	15	0.413738445	0.104623062	0.14705904	0.340913575	0.044926566	0	0	0	0	0
	2019	6	28	10	15	0.421830626	0.119627655	0.15494484	0.424058589	0.045551839	0	0	0	0	0
	2019	6	28	11	15	0.429123932	0.118488341	0.16300214	0.449154061	0.047474475	0	0	0	0	0
	2019	6	28	12	15	0.426287859	0.120583624	0.162925897	0.458738472	0.049842239	0	0	0	0	0
	2019	6	28	13	15	0.409137283	0.118957399	0.153259592	0.483412368	0.051661472	0	0	0	0	0
	2019	6	28	14	15	0.391043408	0.112382455	0.14757708	0.433758118	0.051790198	0	0	0	0	0
	2019	6	28	15	15	0.376248258	0.105620379	0.136735051	0.411467073	0.049497832	0	0	0	0	0
	2019	6	28	16	15	0.340832047	0.094656001	0.113920943	0.353680059	0.046776409	0	0	0	0	0
	2019	6	28	17	15	0.336474934	0.08635304	0.100492827	0.284980189	0.044982391	0	0	0	0	0
	2019	6	28	18	15	0.316698704	0.069508206	0.084422489	0.247113251	0.040282249	0	0	0	0	0
	2019	6	28	19	15	0.277505329	0.050512681	0.070301594	0.208829254	0.032047014	0	0	0	0	0
	2019	6	28	20	15	0.184405984	0.033622957	0.04841087	0.137007996	0.017741403	0	0	0	0	0
	2019	6	28	21	15	0.144179296	0.022839787	0.032097195	0.076049238	0.011024197	0	0	0	0	0
	2019	6	28	22	15	0.119209112	0.017901869	0.023614736	0.047587765	0.008264985	0	0	0	0	0
	2019	6	28	23	15	0.107096977	0.015116348	0.020806342	0.041087487	0.007324662	0	0	0	0	0
6/29/19	2019	6	29	0	15	0.100809096	0.014728554	0.02036426	0.036939068	0.006825157	5.774538651	1.434374265	1.881173228	4.991151688	0.636063988
	2019	6	29	1	15	0.091810791	0.013008156	0.018130244	0.033062776	0.006918191	0	0	0	0	0
	2019	6	29	2	15	0.084210812	0.013077216	0.019158989	0.032454188	0.006850882	0	0	0	0	0
	2019	6	29	3	15	0.085900008	0.013422541	0.020118578	0.031571009	0.007184883	0	0	0	0	0
	2019	6	29	4	15	0.085487454	0.014104002	0.0222929	0.033483892	0.007890231	0	0	0	0	0
	2019	6	29	5	15	0.083528281	0.015572261	0.024688111	0.034202952	0.008245579	0	0	0	0	0
	2019	6	29	6	15	0.084584196	0.017955157	0.028705536	0.042704082	0.009544112	0	0	0	0	0
	2019	6	29	7	15	0.137034249	0.034019791	0.048218376	0.065788508	0.0170777	0	0	0	0	0
	2019	6	29	8	15	0.345348936	0.080968689	0.112009537	0.204397114	0.033795251	0	0	0	0	0
	2019	6	29	9	15	0.335706459	0.084960293	0.125322918	0.296085612	0.037719321	0	0	0	0	0
	2019	6	29	10	15	0.412740935	0.113585925	0.148357529	0.435708477	0.046936239	0	0	0	0	0
	2019	6	29	11	15	0.438034521	0.130370694	0.169498562	0.484772878	0.054999366	0	0	0	0	0
	2019	6	29	12	15	0.437866853	0.126560627	0.160676627	0.460270173	0.048704555	0	0	0	0	0
	2019	6	29	13	15	0.432030924	0.128632085	0.151055378	0.480396589	0.050514637	0	0	0	0	0
	2019	6	29	14	15	0.421050899	0.121609791	0.146520853	0.467906489	0.052754805	0	0	0	0	0
	2019	6	29	15	15	0.414209554	0.118017181	0.148926243	0.435154968	0.052423269	0	0	0	0	0
	2019	6	29	16	15	0.377571138	0.100749671	0.129256159	0.385000389	0.045415718	0	0	0	0	0
	2019	6	29	17	15	0.332379833	0.082114538	0.109527114	0.329270144	0.039571	0	0	0	0	0
	2019	6	29	18	15	0.309150383	0.070731826	0.095157767	0.265932403	0.034653384	0	0	0	0	0
	2019	6	29	19	15	0.239521246	0.046761996	0.060332648	0.165455946	0.022676	0	0	0	0	0
	2019	6	29	20	15	0.17920266	0.035323437	0.047206306	0.1140959	0.018542425	0	0	0	0	0
	2019	6	29	21	15	0.137579042	0.024305003	0.032229583	0.072373393	0.01145415	0	0	0	0	0
	2019	6	29	22	15	0.112270307	0.018200043	0.023485173	0.048144788	0.008213361	0	0	0	0	0
	2019	6	29	23	15	0.096510074	0.015594788	0.019933837	0.03597995	0.007153772	0	0	0	0	0
6/30/19	2019	6	30	0	15	0.087529489	0.013910359	0.018278183	0.030585816	0.007063524	5.017410213	1.30688841	1.619379079	4.242783034	0.557205401
	2019	6	30	1	15	0.084973689	0.013752913	0.019931454	0.030667619	0.007275831	0	0	0	0	0
	2019	6	30	2	15	0.080407522	0.014084616	0.02101622	0.032283392	0.007338038	0	0	0	0	0
	2019	6	30	3	15	0.076839063	0.013652141	0.020431263	0.029566781	0.007419233	0	0	0	0	0
	2019	6	30	4	15	0.075072598	0.013941315	0.021685495	0.02898559	0.007672353	0	0	0	0	0
	2019	6	30	5	15	0.076887356	0.014375413	0.021921597	0.027483665	0.007879262	0	0	0	0	0
	2019	6	30	6	15	0.075998826	0.016378712	0.025022774	0.031607159	0.008940724	0	0	0	0	0
	2019	6	30	7	15	0.161303	0.038359641	0.053026194	0.054141908	0.019659254	0	0	0	0	0
	2019	6	30	8	15	0.185685995	0.049972442	0.076627399	0.104932097	0.025229776	0	0	0	0	0
	2019	6	30	9	15	0.336863465	0.085082038	0.11579203	0.242241457	0.038467477	0	0	0	0	0
	2019	6	30	10	15	0.433621941	0.118865942	0.148039508	0.412819221	0.044970553	0	0	0	0	0
	2019	6	30	11	15	0.440244636	0.12942066	0.159543828	0.464806564	0.051804245	0	0	0	0	0
	2019	6	30	12	15	0.434935936	0.132967301	0.162365168	0.473618635	0.0551535	0	0	0	0	0
	2019	6	30	13	15	0.417614881	0.117683902	0.142178196	0.443739634	0.04869393	0	0	0	0	0
	2019	6	30	14	15	0.421025661	0.125742537	0.144426619	0.464614478	0.052138719	0	0	0	0	0
	2019	6	30	15	15	0.434351501	0.131691709	0.15188064	0.432943281	0.051796556	0	0	0	0	0
	2019	6	30	16	15	0.392047471	0.107607174	0.125736538	0.39242954	0.046882803	0	0	0	0	0
	2019	6	30	17	15	0.282300984	0.071758119	0.085681349	0.28059305	0.029706648	0	0	0	0	0
	2019	6	30	18	15	0.14195608	0.02721183	0.024683855	0.094641445	0.009020205	0	0	0	0	0
	2019	6	30	19	15	0.10360958	0.01988774	0.021108803	0.043705014	0.006793893	0	0	0	0	0
	2019	6	30	20	15	0.081969182	0.017695484	0.021734791	0.042915586	0.007856555	0	0	0	0	0
	2019	6	30	21	15	0.069805462	0.013815229	0.016692222	0.029774122	0.006480376	0	0	0	0	0
	2019	6	30	22	15	0.065999656	0.010936791	0.011855773	0.02817119	0.004917389	0	0	0	0	0
	2019	6	30	23	15	0.056366239	0.008094402	0.00971918	0.02551579	0.004044557	0	0	0	0	0
7/1/19	2019	7	1	0	15	0.052924571	0.00678704	0.008300525	0.021702364	0.004132137	5.195383773	1.28482585	1.510159174	3.936088583	0.538754441
	2019	7	1	1	15	0.05125456	0.006829292	0.007960667	0.01952791	0.004392921	0	0	0	0	0
	2019	7	1	2	15	0.052123941	0.006510081	0.007501899	0.014022175	0.00427062	0	0	0	0	0
	2019	7	1	3	15	0.046561079	0.006657591	0.007132801	0.01327365	0.004134445	0	0	0	0	0
	2019	7	1	4	15	0.045907975	0.006471114	0.006833026	0.011435608	0.004216578	0	0	0	0	0
	2019	7	1	5	15	0.043098487	0.006506109	0.006943284	0.010084204	0.00420835	0	0	0	0	0
	2019	7	1	6	15	0.05030516	0.007034643	0.006823805	0.012876213	0.004808534	0	0	0	0	0
	2019	7	1	7	15	0.088132819	0.011876625	0.011156985	0.011762678	0.008167696	0	0	0	0	0
	2019	7	1	8	15	0.215582243	0.032860698	0.040971194	0.02519115	0.012875893	0	0	0	0	0
	2019	7	1	9	15	0.362285807	0.068634068	0.089324821	0.073717607	0.025248684	0	0	0	0	0
	2019	7	1	10	15	0.405764519	0.097330437	0.116019723	0.183204804	0.033638831	0	0	0	0	0
	2019	7	1	11	15	0.408937039	0.111238442	0.130142859	0.352395095	0.046493112	0	0	0	0	0
	2019	7	1	12	15	0.443869279	0.130831268	0.152535471	0.464228821	0.049795677	0	0	0	0	0
	2019	7	1	13	15	0.438249995	0.129589976	0.150413858	0.468158841	0.046849334	0	0	0	0	0
	2019	7	1	14	15	0.415376174	0.122336227	0.139620442	0.448993735	0.048558915	0	0	0	0	0
	2019	7	1	15	15	0.393964442	0.117735064	0.137943248	0.423844526	0.049994966	0	0	0	0	0
	2019	7	1	16	15	0.391111705	0.114432989	0.129066375	0.402223814	0.04832113	0	0	0	0	0
	2019	7	1	17	15	0.364818223	0.098785859	0.10461621	0.319973933	0.044044846	0	0	0	0	0
	2019	7	1	18	15	0.274856245	0.066921137	0.077021221	0.233732586	0.029009506	0	0	0	0	0
	2019	7	1	19	15	0.186343056	0.039777764	0.050404341	0.130272327	0.01686037	0	0	0	0	0
	2019	7	1	20	15	0.152476115	0.034145638	0.047884203	0.120781407	0.017280132	0	0	0	0	0
	2019	7	1	21	15	0.121184316	0.026287277	0.036242302	0.078988373	0.013390126	0	0	0	0	0
	2019	7	1	22	15	0.104646757	0.019051675	0.025010708	0.054893659	0.010049566	0	0	0	0	0
	2019	7	1	23	15	0.085609266	0.016194836	0.020289206	0.040803103	0.008012072	0	0	0	0	0
7/2/19	2019	7	2	0	15	0.076140132	0.014193127	0.018273383	0.035027766	0.00717421	5.736139351	1.481768982	1.74074203	4.770289428	0.623087761
	2019	7	2	1	15	0.071227302	0.012727617	0.016713261	0.031661708	0.006738457	0	0	0	0	0
	2019	7	2	2	15	0.066109664	0.011954424	0.01641159	0.028055811	0.006678261	0	0	0	0	0
	2019	7	2	3	15	0.066458982	0.012499896	0.017326727	0.027182461	0.007134609	0	0	0	0	0
	2019	7	2	4	15	0.083139461	0.01638279	0.020832676	0.030111757	0.007782073	0	0	0	0	0
	2019	7	2	5	15	0.067365401	0.017396831	0.024479324	0.032307707	0.009158219	0	0	0	0	0
	2019	7	2	6	15	0.068548038	0.016706505	0.023381618	0.038240981	0.009751037	0	0	0	0	0
	2019	7	2	7	15	0.182340872	0.037121511	0.053587565	0.080786989	0.018184702	0	0	0	0	0
	2019	7	2	8	15	0.29073343	0.068990212	0.090602591	0.190899543	0.027262139	0	0	0	0	0
	2019	7	2	9	15	0.431883071	0.112442722	0.126950341	0.36386522	0.03857165	0	0	0	0	0
	2019	7	2	10	15	0.423813894	0.11091724	0.125842821	0.385202251	0.037745833	0	0	0	0	0
	2019	7	2	11	15	0.436294369	0.127859784	0.145102906	0.442545049	0.046687175	0	0	0	0	0
	2019	7	2	12	15	0.431030676	0.129681295	0.151725479	0.434970332	0.05032416	0	0	0	0	0
	2019	7	2	13	15	0.431822127	0.12877099	0.145735732	0.466835289	0.047895047	0	0	0	0	0
	2019	7	2	14	15	0.413682341	0.121190238	0.136449475	0.436289255	0.049024319	0	0	0	0	0
	2019	7	2	15	15	0.405439459	0.116267274	0.136939683	0.402096403	0.04824865	0	0	0	0	0
	2019	7	2	16	15	0.391648569	0.110924324	0.117410215	0.370647165	0.047595737	0	0	0	0	0
	2019	7	2	17	15	0.380474293	0.100969879	0.108530233	0.315833407	0.04595527	0	0	0	0	0
	2019	7	2	18	15	0.316468595	0.07414136	0.085810845	0.25705815	0.036399606	0	0	0	0	0
	2019	7	2	19	15	0.206954309	0.044423165	0.053053906	0.140460807	0.025370159	0	0	0	0	0
	2019	7	2	20	15	0.170826166	0.036428325	0.049271239	0.09343753	0.021287009	0	0	0	0	0
	2019	7	2	21	15	0.125511403	0.025681066	0.033372745	0.070074831	0.012373832	0	0	0	0	0
	2019	7	2	22	15	0.105242674	0.018288561	0.02291609	0.052280462	0.008533446	0	0	0	0	0
	2019	7	2	23	15	0.092984123	0.015809846	0.020021585	0.044418554	0.007212161	0	0	0	0	0
7/3/19	2019	7	3	0	15	0.081911466	0.014473155	0.018110057	0.0367744	0.006748244	5.957948235	1.510295706	1.716365044	4.622392049	0.619241738
	2019	7	3	1	15	0.079542478	0.013156464	0.016148443	0.031948626	0.006317403	0	0	0	0	0
	2019	7	3	2	15	0.07760803	0.013081472	0.017001629	0.031152111	0.006202976	0	0	0	0	0
	2019	7	3	3	15	0.072223972	0.012451999	0.017351551	0.027439298	0.00633841	0	0	0	0	0
	2019	7	3	4	15	0.07055396	0.012750088	0.017846514	0.026254925	0.006653694	0	0	0	0	0
	2019	7	3	5	15	0.072757333	0.012649174	0.018123372	0.023933746	0.006665959	0	0	0	0	0
	2019	7	3	6	15	0.068145193	0.014001899	0.018937111	0.038426462	0.007546461	0	0	0	0	0
	2019	7	3	7	15	0.197771628	0.038724129	0.049555403	0.065241399	0.015826565	0	0	0	0	0
	2019	7	3	8	15	0.338945049	0.073842838	0.09574829	0.135496871	0.027293839	0	0	0	0	0
	2019	7	3	9	15	0.424253985	0.108302293	0.13148028	0.274680221	0.039600393	0	0	0	0	0
	2019	7	3	10	15	0.438093898	0.133292073	0.149914315	0.394533385	0.046413635	0	0	0	0	0
	2019	7	3	11	15	0.440576758	0.13676636	0.161482079	0.439513896	0.047772537	0	0	0	0	0
	2019	7	3	12	15	0.441970698	0.135311003	0.155219687	0.450300255	0.049899661	0	0	0	0	0
	2019	7	3	13	15	0.430006799	0.131261769	0.142713898	0.459824134	0.046993668	0	0	0	0	0
	2019	7	3	14	15	0.402383281	0.115916633	0.126540368	0.436444065	0.046894805	0	0	0	0	0
	2019	7	3	15	15	0.391457177	0.115031193	0.119937466	0.387660567	0.045014587	0	0	0	0	0
	2019	7	3	16	15	0.38789477	0.110475623	0.109218235	0.362619468	0.044997686	0	0	0	0	0
	2019	7	3	17	15	0.35487412	0.094451777	0.089793029	0.279936151	0.041830542	0	0	0	0	0
	2019	7	3	18	15	0.323093324	0.072563146	0.073565944	0.244664727	0.038134416	0	0	0	0	0
	2019	7	3	19	15	0.274316411	0.048420421	0.057015349	0.18170555	0.03031962	0	0	0	0	0
	2019	7	3	20	15	0.198426768	0.036637814	0.049252776	0.123744438	0.021414133	0	0	0	0	0
	2019	7	3	21	15	0.152749653	0.027313631	0.035125559	0.073575132	0.012845174	0	0	0	0	0
	2019	7	3	22	15	0.128814318	0.02109989	0.025296821	0.053565222	0.009403268	0	0	0	0	0
	2019	7	3	23	15	0.109577166	0.018320862	0.020986868	0.042957	0.008114062	0	0	0	0	0
7/4/19	2019	7	4	0	15	0.09854894	0.017212484	0.020098518	0.041540002	0.008149433	6.190279778	1.588334578	1.74672058	5.130668904	0.641782424
	2019	7	4	1	15	0.093103997	0.016863038	0.02017651	0.041505499	0.007989736	0	0	0	0	0
	2019	7	4	2	15	0.087227936	0.016413221	0.021002709	0.052226945	0.007751447	0	0	0	0	0
	2019	7	4	3	15	0.089097829	0.016632432	0.022133556	0.069972438	0.008186644	0	0	0	0	0
	2019	7	4	4	15	0.083535101	0.017344046	0.024457363	0.085312117	0.008696849	0	0	0	0	0
	2019	7	4	5	15	0.083670758	0.017864844	0.025602932	0.100845561	0.009115137	0	0	0	0	0
	2019	7	4	6	15	0.093075187	0.019208438	0.028587971	0.111443237	0.011056292	0	0	0	0	0
	2019	7	4	7	15	0.227948184	0.05558232	0.069624852	0.143464997	0.025025611	0	0	0	0	0
	2019	7	4	8	15	0.396433822	0.09318842	0.112953748	0.256922638	0.035826648	0	0	0	0	0
	2019	7	4	9	15	0.434613452	0.118068541	0.135085083	0.365933528	0.041725816	0	0	0	0	0
	2019	7	4	10	15	0.435138536	0.127538892	0.143401468	0.394001639	0.043113172	0	0	0	0	0
	2019	7	4	11	15	0.442580522	0.137202197	0.149695628	0.435258398	0.046261797	0	0	0	0	0
	2019	7	4	12	15	0.437885941	0.134806511	0.14893084	0.427351979	0.046654053	0	0	0	0	0
	2019	7	4	13	15	0.433511669	0.130729449	0.138350506	0.452690919	0.04760232	0	0	0	0	0
	2019	7	4	14	15	0.421103802	0.125792901	0.12773928	0.442865065	0.047679054	0	0	0	0	0
	2019	7	4	15	15	0.389561622	0.115281066	0.120482858	0.389409266	0.046194022	0	0	0	0	0
	2019	7	4	16	15	0.38980039	0.112543132	0.10667967	0.358042828	0.045212588	0	0	0	0	0
	2019	7	4	17	15	0.363137096	0.097254698	0.0867149	0.271286622	0.041451815	0	0	0	0	0
	2019	7	4	18	15	0.326733304	0.074150078	0.070752835	0.230279593	0.036946894	0	0	0	0	0
	2019	7	4	19	15	0.280203942	0.04664487	0.05342478	0.17397946	0.029038532	0	0	0	0	0
	2019	7	4	20	15	0.198583898	0.034897107	0.045345563	0.120754934	0.01993166	0	0	0	0	0
	2019	7	4	21	15	0.150683849	0.025946537	0.032450787	0.073075036	0.011879252	0	0	0	0	0
	2019	7	4	22	15	0.125456953	0.019862665	0.023326427	0.050341321	0.008634645	0	0	0	0	0
	2019	7	4	23	15	0.108643048	0.017306691	0.019701796	0.042164882	0.007659007	0	0	0	0	0
7/5/19	2019	7	5	0	15	0.098620088	0.016088492	0.018459133	0.039185465	0.007031566	6.16365391	1.550710248	1.661693339	4.928130562	0.607142038
	2019	7	5	1	15	0.092841508	0.014746661	0.017660408	0.041202936	0.006811136	0	0	0	0	0
	2019	7	5	2	15	0.086747319	0.014276648	0.017981871	0.055947919	0.006730492	0	0	0	0	0
	2019	7	5	3	15	0.083702978	0.014204453	0.018390316	0.07125497	0.006836236	0	0	0	0	0
	2019	7	5	4	15	0.082714121	0.014388251	0.019439419	0.086481965	0.007137389	0	0	0	0	0
	2019	7	5	5	15	0.083918291	0.014931654	0.020777493	0.100321162	0.007256368	0	0	0	0	0
	2019	7	5	6	15	0.090605264	0.018114827	0.024041609	0.104278736	0.008603135	0	0	0	0	0
	2019	7	5	7	15	0.211892741	0.04833271	0.063236154	0.131025732	0.020800395	0	0	0	0	0
	2019	7	5	8	15	0.374982715	0.087802617	0.107970071	0.211865863	0.032743268	0	0	0	0	0
	2019	7	5	9	15	0.437322496	0.11833117	0.135373297	0.333359986	0.039336472	0	0	0	0	0
	2019	7	5	10	15	0.4402305	0.133840985	0.142494424	0.382926641	0.043297186	0	0	0	0	0
	2019	7	5	11	15	0.441986457	0.135272521	0.143906388	0.421512417	0.045428761	0	0	0	0	0
	2019	7	5	12	15	0.442463033	0.132247297	0.143788923	0.418213139	0.04546981	0	0	0	0	0
	2019	7	5	13	15	0.433769008	0.13220848	0.130747743	0.443916964	0.04477758	0	0	0	0	0
	2019	7	5	14	15	0.403789363	0.118936644	0.11954002	0.4170462	0.045870844	0	0	0	0	0
	2019	7	5	15	15	0.385369187	0.11469244	0.117300233	0.380039081	0.044116951	0	0	0	0	0
	2019	7	5	16	15	0.39507069	0.110043173	0.101738838	0.33705672	0.042860388	0	0	0	0	0
	2019	7	5	17	15	0.369816809	0.097189521	0.087140948	0.272463531	0.041676918	0	0	0	0	0
	2019	7	5	18	15	0.331854442	0.073046533	0.068766707	0.230496887	0.036098213	0	0	0	0	0
	2019	7	5	19	15	0.28584875	0.047380582	0.051533916	0.16987395	0.02838618	0	0	0	0	0
	2019	7	5	20	15	0.204924253	0.034731164	0.042623877	0.115147829	0.019550208	0	0	0	0	0
	2019	7	5	21	15	0.15272747	0.024923568	0.030198061	0.070352411	0.011400016	0	0	0	0	0
	2019	7	5	22	15	0.124533118	0.018927515	0.020900811	0.049013601	0.00803128	0	0	0	0	0
	2019	7	5	23	15	0.107923309	0.016052342	0.017682679	0.045146457	0.006891246	0	0	0	0	0
7/6/19	2019	7	6	0	15	0.097817679	0.014885252	0.0167868	0.053776453	0.006824241	5.687849443	1.424100401	1.557164045	4.918418369	0.550033351
	2019	7	6	1	15	0.090581138	0.014055293	0.016007449	0.064757631	0.006577348	0	0	0	0	0
	2019	7	6	2	15	0.086706339	0.013160565	0.016632838	0.076666576	0.006289279	0	0	0	0	0
	2019	7	6	3	15	0.084520561	0.012986388	0.01685766	0.088408265	0.006361387	0	0	0	0	0
	2019	7	6	4	15	0.079568396	0.01338165	0.017985312	0.100602673	0.006317542	0	0	0	0	0
	2019	7	6	5	15	0.083819149	0.013107537	0.018528512	0.111705765	0.006402769	0	0	0	0	0
	2019	7	6	6	15	0.080153479	0.014001229	0.020051948	0.113359789	0.006475988	0	0	0	0	0
	2019	7	6	7	15	0.193298081	0.040597145	0.049956157	0.156436946	0.013379703	0	0	0	0	0
	2019	7	6	8	15	0.334350804	0.073723482	0.089776035	0.223997294	0.023827263	0	0	0	0	0
	2019	7	6	9	15	0.41313139	0.104194138	0.117929506	0.304019332	0.036076461	0	0	0	0	0
	2019	7	6	10	15	0.434657835	0.127719383	0.136951114	0.372382959	0.04432625	0	0	0	0	0
	2019	7	6	11	15	0.436664071	0.134517153	0.144347744	0.420693494	0.045790873	0	0	0	0	0
	2019	7	6	12	15	0.428900428	0.12389457	0.130943395	0.398630507	0.044040616	0	0	0	0	0
	2019	7	6	13	15	0.39745085	0.111740003	0.120839566	0.391237995	0.043857774	0	0	0	0	0
	2019	7	6	14	15	0.396756889	0.107342722	0.115844095	0.378421239	0.041727653	0	0	0	0	0
	2019	7	6	15	15	0.392633211	0.111974699	0.117615737	0.387318349	0.044481371	0	0	0	0	0
	2019	7	6	16	15	0.405254762	0.112192852	0.10885217	0.377468525	0.045104362	0	0	0	0	0
	2019	7	6	17	15	0.347311348	0.094329434	0.083675118	0.278486316	0.038891638	0	0	0	0	0
	2019	7	6	18	15	0.268807945	0.064051677	0.067471404	0.216619595	0.028104685	0	0	0	0	0
	2019	7	6	19	15	0.200682589	0.042549089	0.051771096	0.150008457	0.020700026	0	0	0	0	0
	2019	7	6	20	15	0.146640778	0.029444751	0.037433956	0.103148871	0.012753408	0	0	0	0	0
	2019	7	6	21	15	0.111437462	0.021084182	0.026642313	0.067279484	0.00890552	0	0	0	0	0
	2019	7	6	22	15	0.094033802	0.015983784	0.019114621	0.048182633	0.00689381	0	0	0	0	0
	2019	7	6	23	15	0.082670457	0.013183423	0.015149499	0.034809221	0.005923384	0	0	0	0	0
7/7/19	2019	7	7	0	15	0.076043639	0.011808341	0.012861879	0.033754134	0.0050955	4.823073746	1.208291641	1.351150461	4.738120053	0.473141334
	2019	7	7	1	15	0.070931418	0.010344022	0.012625279	0.048596766	0.004853207	0	0	0	0	0
	2019	7	7	2	15	0.066472478	0.009999503	0.011701203	0.063208508	0.00452898	0	0	0	0	0
	2019	7	7	3	15	0.066480253	0.009370711	0.011596798	0.077810562	0.004563096	0	0	0	0	0
	2019	7	7	4	15	0.062452232	0.009992568	0.013164244	0.095690967	0.004796964	0	0	0	0	0
	2019	7	7	5	15	0.063410033	0.01022353	0.01342922	0.111735969	0.005292472	0	0	0	0	0
	2019	7	7	6	15	0.065637868	0.010860885	0.014195739	0.134809617	0.005624019	0	0	0	0	0
	2019	7	7	7	15	0.090744473	0.020001455	0.025497922	0.173213473	0.009938691	0	0	0	0	0
	2019	7	7	8	15	0.152800285	0.041587319	0.054361451	0.22405769	0.019746462	0	0	0	0	0
	2019	7	7	9	15	0.300840284	0.075824984	0.091849807	0.299701345	0.030371169	0	0	0	0	0
	2019	7	7	10	15	0.407199174	0.109153542	0.115723077	0.371714738	0.037842163	0	0	0	0	0
	2019	7	7	11	15	0.420779707	0.122320854	0.13112288	0.441686314	0.045825905	0	0	0	0	0
	2019	7	7	12	15	0.390978352	0.116550466	0.127696681	0.422276748	0.043776	0	0	0	0	0
	2019	7	7	13	15	0.357826381	0.095593768	0.109436793	0.372331409	0.039053929	0	0	0	0	0
	2019	7	7	14	15	0.4320377	0.119421844	0.129370866	0.431064652	0.045984976	0	0	0	0	0
	2019	7	7	15	15	0.404833858	0.111147912	0.114347689	0.385386795	0.041303866	0	0	0	0	0
	2019	7	7	16	15	0.347141926	0.088895229	0.096736129	0.308262253	0.031457387	0	0	0	0	0
	2019	7	7	17	15	0.34360804	0.086523095	0.092172779	0.289369812	0.032921553	0	0	0	0	0
	2019	7	7	18	15	0.2257296	0.051694404	0.055699358	0.1611044	0.018145206	0	0	0	0	0
	2019	7	7	19	15	0.15125189	0.031360291	0.035120293	0.093058612	0.0113895	0	0	0	0	0
	2019	7	7	20	15	0.113563088	0.024280931	0.029878254	0.071486813	0.011174182	0	0	0	0	0
	2019	7	7	21	15	0.086487083	0.017953221	0.022872225	0.054711635	0.008187195	0	0	0	0	0
	2019	7	7	22	15	0.06700163	0.013081401	0.016260857	0.041330189	0.006230348	0	0	0	0	0
	2019	7	7	23	15	0.058822354	0.010301365	0.013429038	0.031756652	0.005038564	0	0	0	0	0
7/8/19	2019	7	8	0	15	0.051991898	0.008422496	0.010522392	0.024099884	0.004037056	4.039859492	1.103453999	1.240831001	4.243939976	0.420548359
	2019	7	8	1	15	0.052053663	0.00819185	0.010387095	0.019733127	0.003927177	0	0	0	0	0
	2019	7	8	2	15	0.048390716	0.00778503	0.009700906	0.019189778	0.0038094	0	0	0	0	0
	2019	7	8	3	15	0.044544225	0.007592794	0.009320044	0.016491115	0.003624462	0	0	0	0	0
	2019	7	8	4	15	0.043711259	0.006849209	0.010594741	0.031252738	0.004069692	0	0	0	0	0
	2019	7	8	5	15	0.044982569	0.007101984	0.013362628	0.047527263	0.004712089	0	0	0	0	0
	2019	7	8	6	15	0.041926895	0.006683863	0.015607166	0.09454584	0.005351455	0	0	0	0	0
	2019	7	8	7	15	0.046600506	0.009137882	0.020403694	0.11596154	0.005553005	0	0	0	0	0
	2019	7	8	8	15	0.064262221	0.009736071	0.022478978	0.133810834	0.004163474	0	0	0	0	0
	2019	7	8	9	15	0.167229914	0.026395845	0.030205233	0.162062479	0.004115414	0	0	0	0	0
	2019	7	8	10	15	0.192670049	0.038880866	0.051655229	0.194274806	0.008939292	0	0	0	0	0
	2019	7	8	11	15	0.372421457	0.084375752	0.085428011	0.254216693	0.020402537	0	0	0	0	0
	2019	7	8	12	15	0.376529292	0.10581903	0.107924798	0.351675971	0.03402395	0	0	0	0	0
	2019	7	8	13	15	0.363235345	0.106217436	0.11062568	0.394054574	0.039148623	0	0	0	0	0
	2019	7	8	14	15	0.396301931	0.118187662	0.125224005	0.440589017	0.046439039	0	0	0	0	0
	2019	7	8	15	15	0.344942092	0.112284099	0.118558288	0.392810986	0.041936015	0	0	0	0	0
	2019	7	8	16	15	0.310889572	0.096969624	0.102508883	0.348683904	0.037570185	0	0	0	0	0
	2019	7	8	17	15	0.30482022	0.093363173	0.098460603	0.334690512	0.038577904	0	0	0	0	0
	2019	7	8	18	15	0.237479856	0.078498556	0.081433439	0.268344623	0.032825814	0	0	0	0	0
	2019	7	8	19	15	0.172198626	0.058422113	0.067456085	0.225984829	0.028981449	0	0	0	0	0
	2019	7	8	20	15	0.125468848	0.042029263	0.053577301	0.152390117	0.020093808	0	0	0	0	0
	2019	7	8	21	15	0.095324752	0.028701373	0.035861545	0.099800403	0.011977748	0	0	0	0	0
	2019	7	8	22	15	0.075928017	0.022304319	0.026696224	0.06711373	0.008650079	0	0	0	0	0
	2019	7	8	23	15	0.065955569	0.019503709	0.022838033	0.054635213	0.007618692	0	0	0	0	0
7/9/19	2019	7	9	0	15	0.059645685	0.018269826	0.021366572	0.047727172	0.007057052	4.45060253	1.417900584	1.490227245	4.834327872	0.571960307
	2019	7	9	1	15	0.057726466	0.01786222	0.020614308	0.046329998	0.007026704	0	0	0	0	0
	2019	7	9	2	15	0.053743086	0.017771083	0.021868191	0.045661174	0.007527437	0	0	0	0	0
	2019	7	9	3	15	0.052066137	0.017945405	0.022521179	0.047353845	0.007531696	0	0	0	0	0
	2019	7	9	4	15	0.050474557	0.01827553	0.022979005	0.048754952	0.00782987	0	0	0	0	0
	2019	7	9	5	15	0.05085436	0.019609903	0.024210244	0.04905714	0.0083638	0	0	0	0	0
	2019	7	9	6	15	0.050741612	0.021578432	0.025906123	0.129708992	0.00929642	0	0	0	0	0
	2019	7	9	7	15	0.096101571	0.046646372	0.05425445	0.168211216	0.019364898	0	0	0	0	0
	2019	7	9	8	15	0.175316853	0.07706511	0.088099164	0.238333676	0.029572634	0	0	0	0	0
	2019	7	9	9	15	0.267116418	0.112243759	0.110224103	0.310173349	0.036698747	0	0	0	0	0
	2019	7	9	10	15	0.288266308	0.124236525	0.118731063	0.364711812	0.041746796	0	0	0	0	0
	2019	7	9	11	15	0.379475357	0.119568061	0.125832871	0.408471463	0.043879511	0	0	0	0	0
	2019	7	9	12	15	0.376529292	0.120321738	0.129172637	0.420077194	0.042862714	0	0	0	0	0
	2019	7	9	13	15	0.363235345	0.113566368	0.116500424	0.441087064	0.042515387	0	0	0	0	0
	2019	7	9	14	15	0.396301931	0.106132007	0.103934305	0.4192737	0.042158348	0	0	0	0	0
	2019	7	9	15	15	0.344942092	0.101267013	0.103347147	0.37568017	0.041385506	0	0	0	0	0
	2019	7	9	16	15	0.310889572	0.096191816	0.092590673	0.34693848	0.040149034	0	0	0	0	0
	2019	7	9	17	15	0.30482022	0.084060164	0.077359217	0.269862815	0.038005519	0	0	0	0	0
	2019	7	9	18	15	0.237479856	0.063573841	0.061935086	0.224577263	0.033112321	0	0	0	0	0
	2019	7	9	19	15	0.172198626	0.040787331	0.047931119	0.164060556	0.025576201	0	0	0	0	0
	2019	7	9	20	15	0.125468848	0.029615596	0.038984029	0.107278225	0.017387105	0	0	0	0	0
	2019	7	9	21	15	0.095324752	0.021105603	0.026833392	0.065101719	0.009919128	0	0	0	0	0
	2019	7	9	22	15	0.075928017	0.016447739	0.018863906	0.047221738	0.006951219	0	0	0	0	0
	2019	7	9	23	15	0.065955569	0.013759142	0.016168037	0.048674159	0.00604226	0	0	0	0	0
7/10/19	2019	7	10	0	15	0.059645685	0.013219375	0.015622998	0.058521833	0.00523274	4.45060253	1.343836732	1.391738486	5.105256037	0.547640591
	2019	7	10	1	15	0.057726466	0.012246436	0.015274416	0.069949717	0.005498034	0	0	0	0	0
	2019	7	10	2	15	0.053743086	0.011944597	0.014754588	0.081708835	0.005629197	0	0	0	0	0
	2019	7	10	3	15	0.052066137	0.012148962	0.015749961	0.094543397	0.005616398	0	0	0	0	0
	2019	7	10	4	15	0.050474557	0.012479603	0.016566947	0.107754747	0.006179184	0	0	0	0	0
	2019	7	10	5	15	0.05085436	0.012347403	0.017487946	0.119982279	0.006206638	0	0	0	0	0
	2019	7	10	6	15	0.050741612	0.014304485	0.021327313	0.19402105	0.007210008	0	0	0	0	0
	2019	7	10	7	15	0.096101571	0.038531988	0.057729954	0.223050518	0.018415392	0	0	0	0	0
	2019	7	10	8	15	0.175316853	0.077339626	0.097444315	0.277241319	0.031518158	0	0	0	0	0
	2019	7	10	9	15	0.267116418	0.103528509	0.121571324	0.338485708	0.038778121	0	0	0	0	0
	2019	7	10	10	15	0.288266308	0.116288277	0.127155461	0.380842552	0.040862549	0	0	0	0	0
	2019	7	10	11	15	0.379475357	0.122090658	0.128901268	0.407082218	0.04193609	0	0	0	0	0
	2019	7	10	12	15	0.376529292	0.119474364	0.11208969	0.394747266	0.041293142	0	0	0	0	0
	2019	7	10	13	15	0.363235345	0.115376901	0.103017619	0.419736545	0.041753466	0	0	0	0	0
	2019	7	10	14	15	0.396301931	0.106654178	0.094291115	0.391367506	0.04141462	0	0	0	0	0
	2019	7	10	15	15	0.344942092	0.101850416	0.093534896	0.347240113	0.039727789	0	0	0	0	0
	2019	7	10	16	15	0.310889572	0.095644051	0.082662759	0.319243238	0.038637309	0	0	0	0	0
	2019	7	10	17	15	0.30482022	0.081280491	0.068765857	0.246261566	0.035535606	0	0	0	0	0
	2019	7	10	18	15	0.237479856	0.060315512	0.054517292	0.208556444	0.031810629	0	0	0	0	0
	2019	7	10	19	15	0.172198626	0.038455625	0.041784508	0.153106276	0.024965173	0	0	0	0	0
	2019	7	10	20	15	0.125468848	0.027713581	0.034358978	0.104124681	0.016524168	0	0	0	0	0
	2019	7	10	21	15	0.095324752	0.020738382	0.023810107	0.067931547	0.009660939	0	0	0	0	0
	2019	7	10	22	15	0.075928017	0.016340029	0.018064951	0.049488663	0.007170732	0	0	0	0	0
	2019	7	10	23	15	0.065955569	0.013523283	0.015254223	0.050268019	0.006064509	0	0	0	0	0
7/11/19	2019	7	11	0	15	0.059645685	0.0126065	0.014621874	0.060117185	0.005200178	4.45060253	1.368189043	1.417106358	5.311720481	0.542694267
	2019	7	11	1	15	0.057726466	0.011666416	0.01483968	0.071054446	0.005133643	0	0	0	0	0
	2019	7	11	2	15	0.053743086	0.011220565	0.015536184	0.081793017	0.005097636	0	0	0	0	0
	2019	7	11	3	15	0.052066137	0.011116309	0.015860454	0.094447519	0.005144892	0	0	0	0	0
	2019	7	11	4	15	0.050474557	0.010877446	0.016444268	0.104994132	0.005347521	0	0	0	0	0
	2019	7	11	5	15	0.05085436	0.011115739	0.017532694	0.116235868	0.005285179	0	0	0	0	0
	2019	7	11	6	15	0.050741612	0.013114666	0.022990598	0.189098288	0.007095059	0	0	0	0	0
	2019	7	11	7	15	0.096101571	0.039566194	0.06403874	0.219898922	0.018628386	0	0	0	0	0
	2019	7	11	8	15	0.175316853	0.071779143	0.095134392	0.27136529	0.02999751	0	0	0	0	0
	2019	7	11	9	15	0.267116418	0.105092926	0.109113018	0.328439744	0.035730002	0	0	0	0	0
	2019	7	11	10	15	0.288266308	0.113829505	0.113389145	0.361016567	0.037870828	0	0	0	0	0
	2019	7	11	11	15	0.379475357	0.120004597	0.114289594	0.389833842	0.041067912	0	0	0	0	0
	2019	7	11	12	15	0.376529292	0.120801441	0.111794444	0.386611652	0.042348015	0	0	0	0	0
	2019	7	11	13	15	0.363235345	0.115348646	0.101512436	0.416227756	0.041349823	0	0	0	0	0
	2019	7	11	14	15	0.396301931	0.103028471	0.097764236	0.389798402	0.040439436	0	0	0	0	0
	2019	7	11	15	15	0.344942092	0.110444323	0.107299365	0.413444652	0.044610105	0	0	0	0	0
	2019	7	11	16	15	0.310889572	0.102868809	0.093663286	0.369135186	0.042640026	0	0	0	0	0
	2019	7	11	17	15	0.30482022	0.091331874	0.083181463	0.299101681	0.04109343	0	0	0	0	0
	2019	7	11	18	15	0.237479856	0.067880146	0.069072641	0.25971973	0.032071773	0	0	0	0	0
	2019	7	11	19	15	0.172198626	0.045935795	0.051627298	0.197640632	0.023172443	0	0	0	0	0
	2019	7	11	20	15	0.125468848	0.030311644	0.035272822	0.124934422	0.013501006	0	0	0	0	0
	2019	7	11	21	15	0.095324752	0.020062415	0.022283363	0.071814215	0.008414598	0	0	0	0	0
	2019	7	11	22	15	0.075928017	0.015231409	0.015908221	0.050895092	0.006150123	0	0	0	0	0
	2019	7	11	23	15	0.065955569	0.012954064	0.013936142	0.044102241	0.005304743	0	0	0	0	0
7/12/19	2019	7	12	0	15	0.059645685	0.011651054	0.013259032	0.041221555	0.005105859	4.340394745	1.294300068	1.315488949	4.830046368	0.527784987
	2019	7	12	1	15	0.057726466	0.010780062	0.01272934	0.039826577	0.004921461	0	0	0	0	0
	2019	7	12	2	15	0.053743086	0.010351172	0.012734807	0.038771819	0.004825143	0	0	0	0	0
	2019	7	12	3	15	0.052066137	0.009853307	0.013268172	0.037914923	0.004763922	0	0	0	0	0
	2019	7	12	4	15	0.050474557	0.009928437	0.01414616	0.037345441	0.005112101	0	0	0	0	0
	2019	7	12	5	15	0.05085436	0.010168835	0.014657375	0.037138508	0.005123564	0	0	0	0	0
	2019	7	12	6	15	0.050741612	0.011394419	0.017613	0.138553391	0.006048835	0	0	0	0	0
	2019	7	12	7	15	0.096101571	0.037820682	0.054139524	0.179859594	0.016332276	0	0	0	0	0
	2019	7	12	8	15	0.175316853	0.070538386	0.087824992	0.242630049	0.030160529	0	0	0	0	0
	2019	7	12	9	15	0.267116418	0.097664058	0.105409991	0.312319049	0.035871243	0	0	0	0	0
	2019	7	12	10	15	0.288266308	0.113141193	0.11178245	0.361330978	0.038954497	0	0	0	0	0
	2019	7	12	11	15	0.379475357	0.119399083	0.111298476	0.399298909	0.041622983	0	0	0	0	0
	2019	7	12	12	15	0.362080233	0.118129431	0.109404668	0.396325731	0.044269945	0	0	0	0	0
	2019	7	12	13	15	0.368644308	0.119865117	0.10738377	0.447486396	0.0413132	0	0	0	0	0
	2019	7	12	14	15	0.360566162	0.113394198	0.104786945	0.409686296	0.042377641	0	0	0	0	0
	2019	7	12	15	15	0.285050325	0.092708524	0.090945093	0.3905035	0.04405236	0	0	0	0	0
	2019	7	12	16	15	0.274637219	0.093752252	0.087551958	0.368896493	0.039032495	0	0	0	0	0
	2019	7	12	17	15	0.2660324	0.074386152	0.07381619	0.300484741	0.035012507	0	0	0	0	0
	2019	7	12	18	15	0.249230111	0.06072154	0.05879975	0.248789879	0.031560757	0	0	0	0	0
	2019	7	12	19	15	0.193145361	0.037043763	0.037646721	0.150771158	0.019229846	0	0	0	0	0
	2019	7	12	20	15	0.137374608	0.025572177	0.02725808	0.098418752	0.012316261	0	0	0	0	0
	2019	7	12	21	15	0.10416242	0.018351342	0.019804929	0.063291663	0.008221682	0	0	0	0	0
	2019	7	12	22	15	0.084854404	0.014984809	0.015608105	0.047450237	0.006279105	0	0	0	0	0
	2019	7	12	23	15	0.073088784	0.012700075	0.013619421	0.041730729	0.005276775	0	0	0	0	0
7/13/19	2019	7	13	0	15	0.067299471	0.011435501	0.012772376	0.038569556	0.004941479	4.738573597	1.242198841	1.27125015	4.351908955	0.482440457
	2019	7	13	1	15	0.063399269	0.010832145	0.012565921	0.037874753	0.004605826	0	0	0	0	0
	2019	7	13	2	15	0.059095456	0.010333325	0.012682599	0.036359632	0.004581381	0	0	0	0	0
	2019	7	13	3	15	0.05958805	0.009896407	0.01268103	0.036333624	0.004506121	0	0	0	0	0
	2019	7	13	4	15	0.057237855	0.009875455	0.013041065	0.034937168	0.00458209	0	0	0	0	0
	2019	7	13	5	15	0.056726151	0.010262364	0.014102125	0.034797027	0.005062599	0	0	0	0	0
	2019	7	13	6	15	0.059556328	0.011469164	0.017850744	0.057073879	0.006055734	0	0	0	0	0
	2019	7	13	7	15	0.145602636	0.040189858	0.055852431	0.107116071	0.015959425	0	0	0	0	0
	2019	7	13	8	15	0.286371486	0.067823973	0.085357726	0.186858561	0.02794981	0	0	0	0	0
	2019	7	13	9	15	0.367002923	0.10190984	0.105063233	0.277345131	0.035066845	0	0	0	0	0
	2019	7	13	10	15	0.383862568	0.11527406	0.110380809	0.340895376	0.037440299	0	0	0	0	0
	2019	7	13	11	15	0.386529257	0.117408274	0.108318676	0.393633473	0.039401829	0	0	0	0	0
	2019	7	13	12	15	0.389641944	0.120586576	0.109618274	0.41341779	0.042613449	0	0	0	0	0
	2019	7	13	13	15	0.336407616	0.097229403	0.089724304	0.358195871	0.035849105	0	0	0	0	0
	2019	7	13	14	15	0.33309832	0.098389894	0.096509525	0.401154005	0.040580429	0	0	0	0	0
	2019	7	13	15	15	0.336281228	0.100766276	0.092571684	0.375805013	0.03824501	0	0	0	0	0
	2019	7	13	16	15	0.310935843	0.081977232	0.080483808	0.32227586	0.032940466	0	0	0	0	0
	2019	7	13	17	15	0.229162157	0.057374575	0.06157573	0.231654551	0.02385064	0	0	0	0	0
	2019	7	13	18	15	0.222849979	0.055899615	0.059278825	0.235505376	0.025631185	0	0	0	0	0
	2019	7	13	19	15	0.182129832	0.040636661	0.043270258	0.165184431	0.019255194	0	0	0	0	0
	2019	7	13	20	15	0.13826463	0.027189979	0.029424026	0.10289692	0.013716563	0	0	0	0	0
	2019	7	13	21	15	0.106495614	0.018679531	0.019680718	0.065102054	0.008195897	0	0	0	0	0
	2019	7	13	22	15	0.08620459	0.014293123	0.014801161	0.048804559	0.006116915	0	0	0	0	0
	2019	7	13	23	15	0.074830394	0.01246561	0.013643102	0.050118274	0.005292166	0	0	0	0	0
7/14/19	2019	7	14	0	15	0.067628406	0.01112018	0.012600587	0.060321182	0.0047764	4.442250213	1.149910003	1.164350207	5.212964942	0.462265394
	2019	7	14	1	15	0.062837418	0.010493367	0.012480225	0.071762175	0.004435487	0	0	0	0	0
	2019	7	14	2	15	0.058492392	0.009570736	0.012121568	0.0840055	0.004279402	0	0	0	0	0
	2019	7	14	3	15	0.055561088	0.009435441	0.012756471	0.096335408	0.004364414	0	0	0	0	0
	2019	7	14	4	15	0.05294216	0.009182302	0.012444672	0.107869135	0.004287161	0	0	0	0	0
	2019	7	14	5	15	0.052868847	0.009512397	0.013197246	0.122167674	0.004414099	0	0	0	0	0
	2019	7	14	6	15	0.052298381	0.00974722	0.014811574	0.196282566	0.00468324	0	0	0	0	0
	2019	7	14	7	15	0.075173322	0.020226095	0.028630139	0.227216912	0.009087302	0	0	0	0	0
	2019	7	14	8	15	0.098421576	0.031842821	0.045916767	0.26485377	0.015085884	0	0	0	0	0
	2019	7	14	9	15	0.178381869	0.052453366	0.067097769	0.313545091	0.023191524	0	0	0	0	0
	2019	7	14	10	15	0.359000346	0.098275388	0.098671989	0.369891733	0.035022563	0	0	0	0	0
	2019	7	14	11	15	0.372665674	0.098782484	0.10026559	0.402725589	0.038563304	0	0	0	0	0
	2019	7	14	12	15	0.362695146	0.11473796	0.111951727	0.435444033	0.043571348	0	0	0	0	0
	2019	7	14	13	15	0.362298844	0.103574824	0.095676489	0.418767453	0.038929573	0	0	0	0	0
	2019	7	14	14	15	0.333075891	0.097343616	0.096635557	0.386083902	0.039068061	0	0	0	0	0
	2019	7	14	15	15	0.357146401	0.106259696	0.099736581	0.403903106	0.041213784	0	0	0	0	0
	2019	7	14	16	15	0.336060393	0.098512364	0.081718431	0.351486071	0.036772028	0	0	0	0	0
	2019	7	14	17	15	0.326649061	0.084980475	0.068647228	0.266345721	0.033296826	0	0	0	0	0
	2019	7	14	18	15	0.26003746	0.058671171	0.054398357	0.213523199	0.025624955	0	0	0	0	0
	2019	7	14	19	15	0.210240646	0.039961816	0.041818912	0.153518178	0.019324148	0	0	0	0	0
	2019	7	14	20	15	0.145695875	0.02869771	0.032974783	0.108470325	0.013218348	0	0	0	0	0
	2019	7	14	21	15	0.106683175	0.019249757	0.020731982	0.067503769	0.00823613	0	0	0	0	0
	2019	7	14	22	15	0.083296071	0.014687822	0.01546682	0.049511412	0.00575188	0	0	0	0	0
	2019	7	14	23	15	0.072099771	0.012590995	0.013598743	0.041431038	0.005067533	0	0	0	0	0
7/15/19	2019	7	15	0	15	0.065064001	0.011034819	0.012214395	0.037871926	0.004408069	4.669418735	1.218112938	1.194306653	4.409181405	0.452255031
	2019	7	15	1	15	0.059070018	0.010279903	0.011552142	0.034806597	0.004225175	0	0	0	0	0
	2019	7	15	2	15	0.054838046	0.009229362	0.011189036	0.031524809	0.003909802	0	0	0	0	0
	2019	7	15	3	15	0.051762211	0.00874039	0.010891558	0.029727184	0.003945754	0	0	0	0	0
	2019	7	15	4	15	0.048825288	0.008338432	0.010742965	0.02706763	0.003848614	0	0	0	0	0
	2019	7	15	5	15	0.047741667	0.00795972	0.010739272	0.026247231	0.003855518	0	0	0	0	0
	2019	7	15	6	15	0.046407672	0.008361151	0.012291728	0.049695252	0.004189775	0	0	0	0	0
	2019	7	15	7	15	0.105269074	0.026016655	0.040284293	0.085294923	0.010646557	0	0	0	0	0
	2019	7	15	8	15	0.237753287	0.05800089	0.073002832	0.161540829	0.023168335	0	0	0	0	0
	2019	7	15	9	15	0.348173578	0.086921551	0.090232288	0.28289453	0.03238839	0	0	0	0	0
	2019	7	15	10	15	0.388954844	0.109533135	0.106710914	0.355912859	0.036595544	0	0	0	0	0
	2019	7	15	11	15	0.384777612	0.12035279	0.107862678	0.40190954	0.038188174	0	0	0	0	0
	2019	7	15	12	15	0.37554755	0.117344682	0.105127042	0.398344141	0.039507168	0	0	0	0	0
	2019	7	15	13	15	0.396322596	0.11614143	0.098751146	0.434953629	0.039776274	0	0	0	0	0
	2019	7	15	14	15	0.323850136	0.093723587	0.086030749	0.377244016	0.034373997	0	0	0	0	0
	2019	7	15	15	15	0.317350479	0.091227595	0.087876023	0.373962135	0.03670104	0	0	0	0	0
	2019	7	15	16	15	0.302420608	0.095126894	0.081298009	0.36836802	0.035245498	0	0	0	0	0
	2019	7	15	17	15	0.31140786	0.080657363	0.070677404	0.30621876	0.032765802	0	0	0	0	0
	2019	7	15	18	15	0.247044318	0.055126018	0.054048627	0.223144581	0.022386949	0	0	0	0	0
	2019	7	15	19	15	0.160856722	0.03101019	0.032102392	0.119633192	0.011802484	0	0	0	0	0
	2019	7	15	20	15	0.137646431	0.026290072	0.029654865	0.111413965	0.011238949	0	0	0	0	0
	2019	7	15	21	15	0.101800349	0.019036757	0.021896889	0.074479582	0.008008973	0	0	0	0	0
	2019	7	15	22	15	0.083914857	0.014993938	0.015888646	0.052666825	0.005886962	0	0	0	0	0
	2019	7	15	23	15	0.072619531	0.012665614	0.01324076	0.044259249	0.005191228	0	0	0	0	0
7/16/19	2019	7	16	0	15	0.066763468	0.011451351	0.012054472	0.041162232	0.004549902	4.958074282	1.226982975	1.152361894	4.544082928	0.442587713
	2019	7	16	1	15	0.061958453	0.010388538	0.011477021	0.038379982	0.004229037	0	0	0	0	0
	2019	7	16	2	15	0.057001064	0.009698555	0.011395459	0.036024599	0.003974252	0	0	0	0	0
	2019	7	16	3	15	0.055766235	0.009214751	0.010984895	0.03484813	0.003756283	0	0	0	0	0
	2019	7	16	4	15	0.05587664	0.008817677	0.010838519	0.032437062	0.004087584	0	0	0	0	0
	2019	7	16	5	15	0.053199171	0.009625584	0.01180676	0.033460185	0.003755366	0	0	0	0	0
	2019	7	16	6	15	0.055775689	0.010070155	0.013867409	0.118613214	0.004393799	0	0	0	0	0
	2019	7	16	7	15	0.129909463	0.029765818	0.042112627	0.141934447	0.010796273	0	0	0	0	0
	2019	7	16	8	15	0.261754933	0.060558854	0.073944685	0.22213635	0.02156086	0	0	0	0	0
	2019	7	16	9	15	0.364938854	0.091543244	0.091695166	0.311740806	0.02911043	0	0	0	0	0
	2019	7	16	10	15	0.392540509	0.105626904	0.100473898	0.348028442	0.032845282	0	0	0	0	0
	2019	7	16	11	15	0.391909259	0.110163342	0.099469152	0.371299924	0.03348289	0	0	0	0	0
	2019	7	16	12	15	0.367003421	0.105408128	0.097151222	0.381970229	0.037514732	0	0	0	0	0
	2019	7	16	13	15	0.38978854	0.112457857	0.097082424	0.422901107	0.038217641	0	0	0	0	0
	2019	7	16	14	15	0.346991293	0.099686518	0.090979345	0.401772979	0.036204594	0	0	0	0	0
	2019	7	16	15	15	0.313556726	0.09196053	0.081818069	0.350184397	0.033174937	0	0	0	0	0
	2019	7	16	16	15	0.331724055	0.090703035	0.072871649	0.342643258	0.033486294	0	0	0	0	0
	2019	7	16	17	15	0.317712013	0.079704026	0.062866113	0.272924689	0.03065217	0	0	0	0	0
	2019	7	16	18	15	0.284474175	0.061972021	0.053536779	0.241492339	0.02965369	0	0	0	0	0
	2019	7	16	19	15	0.218900005	0.040146805	0.037636318	0.163055534	0.018111968	0	0	0	0	0
	2019	7	16	20	15	0.153881636	0.027863829	0.027603364	0.105081425	0.011716441	0	0	0	0	0
	2019	7	16	21	15	0.115600201	0.02164911	0.018648515	0.062579133	0.00731485	0	0	0	0	0
	2019	7	16	22	15	0.092957059	0.015956558	0.01229716	0.039750698	0.005484552	0	0	0	0	0
	2019	7	16	23	15	0.07809142	0.012549785	0.009750873	0.029661767	0.004513886	0	0	0	0	0
7/17/19	2019	7	17	0	15	0.070704755	0.011162385	0.009514485	0.025862409	0.004342487	4.907081324	1.191238598	1.104668156	4.387473393	0.433056039
	2019	7	17	1	15	0.065447923	0.010017374	0.008497861	0.023632673	0.004328838	0	0	0	0	0
	2019	7	17	2	15	0.060031294	0.009240108	0.00877066	0.022422941	0.003508553	0	0	0	0	0
	2019	7	17	3	15	0.056985213	0.008497792	0.008463425	0.018790344	0.0034456	0	0	0	0	0
	2019	7	17	4	15	0.053857817	0.007440943	0.008007644	0.016122307	0.003191481	0	0	0	0	0
	2019	7	17	5	15	0.053066838	0.007953867	0.008496294	0.016245836	0.003187299	0	0	0	0	0
	2019	7	17	6	15	0.053047567	0.008151477	0.009358761	0.105212912	0.003429177	0	0	0	0	0
	2019	7	17	7	15	0.108518174	0.02135211	0.029433424	0.134830602	0.008956711	0	0	0	0	0
	2019	7	17	8	15	0.236683064	0.048545142	0.058754188	0.185652766	0.019532333	0	0	0	0	0
	2019	7	17	9	15	0.338281029	0.078233931	0.082384787	0.256679416	0.028131216	0	0	0	0	0
	2019	7	17	10	15	0.383622537	0.097940557	0.094764848	0.325470597	0.028956857	0	0	0	0	0
	2019	7	17	11	15	0.385265045	0.113264745	0.102355218	0.369360146	0.035340088	0	0	0	0	0
	2019	7	17	12	15	0.365585224	0.09845611	0.092306741	0.365945431	0.033282346	0	0	0	0	0
	2019	7	17	13	15	0.373974876	0.106916372	0.09262851	0.403697165	0.034789432	0	0	0	0	0
	2019	7	17	14	15	0.332210745	0.103127539	0.086900702	0.39232425	0.036171125	0	0	0	0	0
	2019	7	17	15	15	0.307446123	0.099773319	0.08628745	0.377040182	0.035279359	0	0	0	0	0
	2019	7	17	16	15	0.31475702	0.091849097	0.079236312	0.35501651	0.033606688	0	0	0	0	0
	2019	7	17	17	15	0.310604851	0.082766948	0.067527919	0.294466039	0.031943356	0	0	0	0	0
	2019	7	17	18	15	0.290331522	0.063698437	0.052639491	0.233916678	0.028683749	0	0	0	0	0
	2019	7	17	19	15	0.249622519	0.040366279	0.038049484	0.171784867	0.021222195	0	0	0	0	0
	2019	7	17	20	15	0.172512418	0.029780955	0.029641936	0.118224025	0.013136575	0	0	0	0	0
	2019	7	17	21	15	0.128733699	0.020812651	0.020574386	0.072658616	0.007631965	0	0	0	0	0
	2019	7	17	22	15	0.105800352	0.016763603	0.015854831	0.054341323	0.005897985	0	0	0	0	0
	2019	7	17	23	15	0.089990719	0.015126857	0.014218799	0.047775358	0.005060624	0	0	0	0	0
7/18/19	2019	7	18	0	15	0.081813301	0.013542178	0.013602739	0.045550394	0.004659466	5.185124859	1.262512834	1.192267314	4.663365857	0.44915614
	2019	7	18	1	15	0.075162609	0.013009437	0.013050717	0.043143157	0.004570915	0	0	0	0	0
	2019	7	18	2	15	0.069216179	0.011727715	0.012980709	0.041539526	0.004304694	0	0	0	0	0
	2019	7	18	3	15	0.066055539	0.011553795	0.013339174	0.04248755	0.004112746	0	0	0	0	0
	2019	7	18	4	15	0.063204023	0.011272708	0.014324668	0.041743219	0.004290968	0	0	0	0	0
	2019	7	18	5	15	0.064218112	0.011275257	0.014795824	0.04077055	0.004348545	0	0	0	0	0
	2019	7	18	6	15	0.067828046	0.012273313	0.016644584	0.126515982	0.00494425	0	0	0	0	0
	2019	7	18	7	15	0.142821025	0.036233451	0.048085663	0.163147296	0.014285343	0	0	0	0	0
	2019	7	18	8	15	0.270257017	0.064427512	0.077477542	0.246869444	0.024476272	0	0	0	0	0
	2019	7	18	9	15	0.36741004	0.094245524	0.094442397	0.323319157	0.029094523	0	0	0	0	0
	2019	7	18	10	15	0.390731071	0.106772357	0.100392768	0.348700654	0.032897031	0	0	0	0	0
	2019	7	18	11	15	0.411080047	0.112131904	0.101320424	0.388260146	0.034695017	0	0	0	0	0
	2019	7	18	12	15	0.397371911	0.113428338	0.100118636	0.39336996	0.035807832	0	0	0	0	0
	2019	7	18	13	15	0.376995019	0.108677456	0.093243703	0.413212815	0.03539929	0	0	0	0	0
	2019	7	18	14	15	0.346926583	0.102627035	0.088320573	0.390750663	0.035509159	0	0	0	0	0
	2019	7	18	15	15	0.323595727	0.097624939	0.085597068	0.36648408	0.034975805	0	0	0	0	0
	2019	7	18	16	15	0.319038397	0.092733181	0.080658646	0.357174146	0.034302324	0	0	0	0	0
	2019	7	18	17	15	0.319662901	0.080497684	0.065253825	0.277844242	0.031639985	0	0	0	0	0
	2019	7	18	18	15	0.285369341	0.057168054	0.047679186	0.205617069	0.02669752	0	0	0	0	0
	2019	7	18	19	15	0.256319361	0.036777171	0.035796529	0.153921656	0.019616498	0	0	0	0	0
	2019	7	18	20	15	0.170025037	0.025839641	0.02765159	0.101129377	0.011365142	0	0	0	0	0
	2019	7	18	21	15	0.127905419	0.019170676	0.018937143	0.062852309	0.007046802	0	0	0	0	0
	2019	7	18	22	15	0.103343124	0.01576172	0.015216958	0.047320812	0.00525326	0	0	0	0	0
	2019	7	18	23	15	0.08877503	0.013741788	0.013336248	0.041641653	0.004862753	0	0	0	0	0
7/19/19	2019	7	19	0	15	0.080976169	0.012684271	0.01293843	0.040021444	0.004265893	5.136974765	1.23039158	1.11885307	4.342247891	0.408424707
	2019	7	19	1	15	0.07500011	0.012059234	0.012497133	0.038921083	0.004124982	0	0	0	0	0
	2019	7	19	2	15	0.070342606	0.011376412	0.012521501	0.038176671	0.003914939	0	0	0	0	0
	2019	7	19	3	15	0.067776756	0.010942627	0.012323762	0.037979576	0.003812456	0	0	0	0	0
	2019	7	19	4	15	0.067076198	0.010656646	0.012732551	0.037849986	0.003901241	0	0	0	0	0
	2019	7	19	5	15	0.065042361	0.010492521	0.012912808	0.037195477	0.003747837	0	0	0	0	0
	2019	7	19	6	15	0.070398756	0.011541719	0.015557178	0.119532607	0.004537503	0	0	0	0	0
	2019	7	19	7	15	0.163859982	0.038158733	0.051550547	0.157180897	0.013287601	0	0	0	0	0
	2019	7	19	8	15	0.328458244	0.071378135	0.079968048	0.244323351	0.023942097	0	0	0	0	0
	2019	7	19	9	15	0.38196627	0.093276609	0.096293398	0.319159984	0.028670821	0	0	0	0	0
	2019	7	19	10	15	0.383702581	0.107133436	0.099713197	0.333867557	0.030703044	0	0	0	0	0
	2019	7	19	11	15	0.39349927	0.112571592	0.098831725	0.365352855	0.032000891	0	0	0	0	0
	2019	7	19	12	15	0.400035947	0.109964824	0.094539819	0.363359428	0.031168059	0	0	0	0	0
	2019	7	19	13	15	0.372510954	0.105735245	0.08651832	0.384055305	0.031335182	0	0	0	0	0
	2019	7	19	14	15	0.335102095	0.096528736	0.075968449	0.359193273	0.031795336	0	0	0	0	0
	2019	7	19	15	15	0.318051261	0.092950375	0.074884842	0.325228846	0.030543767	0	0	0	0	0
	2019	7	19	16	15	0.294695818	0.086478122	0.067097592	0.310638862	0.029188399	0	0	0	0	0
	2019	7	19	17	15	0.284928185	0.073884978	0.055109543	0.241371946	0.027285961	0	0	0	0	0
	2019	7	19	18	15	0.269260404	0.054052117	0.042752594	0.192755602	0.024215979	0	0	0	0	0
	2019	7	19	19	15	0.236683089	0.034693247	0.032320716	0.143876724	0.018369909	0	0	0	0	0
	2019	7	19	20	15	0.161563787	0.025674961	0.025606637	0.098669812	0.011223816	0	0	0	0	0
	2019	7	19	21	15	0.123994373	0.019009538	0.018465853	0.063605664	0.006800104	0	0	0	0	0
	2019	7	19	22	15	0.103165385	0.015447355	0.014519352	0.047573458	0.005064305	0	0	0	0	0
	2019	7	19	23	15	0.088884164	0.013700147	0.013229075	0.042357483	0.004524585	0	0	0	0	0
7/20/19	2019	7	20	0	15	0.080622287	0.012486364	0.012551291	0.039494422	0.004187255	4.378543938	1.029487317	1.041609629	3.94829753	0.352393141
	2019	7	20	1	15	0.075692831	0.011504259	0.012008092	0.038629796	0.003880127	0	0	0	0	0
	2019	7	20	2	15	0.069798743	0.010902406	0.011687836	0.037265461	0.003639799	0	0	0	0	0
	2019	7	20	3	15	0.066980083	0.010751371	0.012435935	0.037038239	0.003594855	0	0	0	0	0
	2019	7	20	4	15	0.065444742	0.010268399	0.012724461	0.036399908	0.003484374	0	0	0	0	0
	2019	7	20	5	15	0.06365034	0.010141046	0.013081356	0.036434079	0.003511003	0	0	0	0	0
	2019	7	20	6	15	0.065115832	0.011202677	0.016516405	0.126532901	0.004844817	0	0	0	0	0
	2019	7	20	7	15	0.165960646	0.037637299	0.051273895	0.170132027	0.013143507	0	0	0	0	0
	2019	7	20	8	15	0.322404433	0.067613474	0.080376905	0.258156643	0.023834029	0	0	0	0	0
	2019	7	20	9	15	0.346207416	0.081128889	0.088970259	0.317144719	0.027203083	0	0	0	0	0
	2019	7	20	10	15	0.375750509	0.10537409	0.099392655	0.352883593	0.032110019	0	0	0	0	0
	2019	7	20	11	15	0.378932943	0.107251985	0.09662755	0.37551634	0.032418176	0	0	0	0	0
	2019	7	20	12	15	0.366581809	0.103192584	0.094181854	0.374596957	0.03136835	0	0	0	0	0
	2019	7	20	13	15	0.36033731	0.102983542	0.088061745	0.387560205	0.031793135	0	0	0	0	0
	2019	7	20	14	15	0.324867624	0.091027323	0.084832245	0.372272816	0.031493937	0	0	0	0	0
	2019	7	20	15	15	0.247347498	0.062888596	0.062943613	0.279458679	0.02266969	0	0	0	0	0
	2019	7	20	16	15	0.148750024	0.030220844	0.029163309	0.103596475	0.009505296	0	0	0	0	0
	2019	7	20	17	15	0.137453899	0.028897189	0.028297513	0.090401113	0.009390357	0	0	0	0	0
	2019	7	20	18	15	0.176267934	0.041392562	0.040486425	0.160359516	0.018627657	0	0	0	0	0
	2019	7	20	19	15	0.156060681	0.031262094	0.03345224	0.138164625	0.01590043	0	0	0	0	0
	2019	7	20	20	15	0.133752879	0.023134533	0.027423266	0.091668319	0.010809175	0	0	0	0	0
	2019	7	20	21	15	0.098358138	0.015474709	0.01861325	0.052832238	0.006473364	0	0	0	0	0
	2019	7	20	22	15	0.081328639	0.012057984	0.01389096	0.037847975	0.004506091	0	0	0	0	0
	2019	7	20	23	15	0.070876698	0.010693098	0.012616569	0.033910484	0.004004615	0	0	0	0	0
7/21/19	2019	7	21	0	15	0.065037549	0.009892294	0.011682548	0.031356737	0.003696587	4.959798229	1.163085805	1.04822134	4.21313915	0.367609324
	2019	7	21	1	15	0.061168851	0.009386644	0.011229498	0.029514666	0.003425404	0	0	0	0	0
	2019	7	21	2	15	0.05906422	0.008719052	0.010725467	0.027516675	0.00304975	0	0	0	0	0
	2019	7	21	3	15	0.059522893	0.008202715	0.010467535	0.026065005	0.003117171	0	0	0	0	0
	2019	7	21	4	15	0.062008189	0.008281806	0.010503029	0.02473211	0.003047268	0	0	0	0	0
	2019	7	21	5	15	0.061411801	0.008527167	0.010854922	0.02495464	0.003005288	0	0	0	0	0
	2019	7	21	6	15	0.064044121	0.009140586	0.011483403	0.11918975	0.00305919	0	0	0	0	0
	2019	7	21	7	15	0.144854048	0.028023073	0.03740913	0.135025621	0.008855554	0	0	0	0	0
	2019	7	21	8	15	0.284371399	0.058099753	0.065843732	0.196850448	0.017677216	0	0	0	0	0
	2019	7	21	9	15	0.357817057	0.083839789	0.08282788	0.30009007	0.023477762	0	0	0	0	0
	2019	7	21	10	15	0.382632157	0.100383772	0.09251923	0.329029566	0.028144282	0	0	0	0	0
	2019	7	21	11	15	0.386748708	0.106350928	0.093652838	0.35974699	0.029781378	0	0	0	0	0
	2019	7	21	12	15	0.388600522	0.107808201	0.09212079	0.364352983	0.031056772	0	0	0	0	0
	2019	7	21	13	15	0.378693541	0.102727251	0.08240978	0.390469787	0.029859342	0	0	0	0	0
	2019	7	21	14	15	0.34022354	0.094002688	0.072183362	0.35540239	0.028728716	0	0	0	0	0
	2019	7	21	15	15	0.3110902	0.090082953	0.07320747	0.314683977	0.028380372	0	0	0	0	0
	2019	7	21	16	15	0.293618854	0.085259184	0.067238471	0.320384664	0.027372258	0	0	0	0	0
	2019	7	21	17	15	0.278853593	0.075147186	0.058753759	0.247502606	0.02572233	0	0	0	0	0
	2019	7	21	18	15	0.282797857	0.058636432	0.048405484	0.213816191	0.023264095	0	0	0	0	0
	2019	7	21	19	15	0.229730464	0.036070292	0.034222889	0.151552602	0.017445282	0	0	0	0	0
	2019	7	21	20	15	0.15537055	0.025926664	0.025530867	0.098655803	0.010196717	0	0	0	0	0
	2019	7	21	21	15	0.121608476	0.019179795	0.017440701	0.065448754	0.006358659	0	0	0	0	0
	2019	7	21	22	15	0.102355417	0.0157812	0.0145185	0.044881591	0.004700144	0	0	0	0	0
	2019	7	21	23	15	0.088174222	0.01361638	0.012990055	0.041915524	0.004187787	0	0	0	0	0
7/22/19	2019	7	22	0	15	0.07875948	0.011981406	0.011899203	0.035747161	0.003769415	4.476014685	1.048582957	1.027286877	4.068948134	0.317994583
	2019	7	22	1	15	0.070295811	0.010575896	0.011274203	0.033013467	0.00338861	0	0	0	0	0
	2019	7	22	2	15	0.064611246	0.009614024	0.01055192	0.029906954	0.002976269	0	0	0	0	0
	2019	7	22	3	15	0.060634515	0.009228073	0.010168643	0.027894522	0.002934176	0	0	0	0	0
	2019	7	22	4	15	0.057643724	0.008317408	0.010032546	0.02552239	0.002579162	0	0	0	0	0
	2019	7	22	5	15	0.055221408	0.007685706	0.009691255	0.02315401	0.002527094	0	0	0	0	0
	2019	7	22	6	15	0.054047024	0.007795085	0.00994037	0.112089722	0.002520473	0	0	0	0	0
	2019	7	22	7	15	0.115892984	0.022700139	0.033705388	0.142996479	0.006768598	0	0	0	0	0
	2019	7	22	8	15	0.253094079	0.049162878	0.062208199	0.197524712	0.014310306	0	0	0	0	0
	2019	7	22	9	15	0.349788883	0.080045178	0.083151596	0.258246286	0.019934863	0	0	0	0	0
	2019	7	22	10	15	0.38152739	0.096106642	0.089215801	0.298004207	0.023630112	0	0	0	0	0
	2019	7	22	11	15	0.375561293	0.100352417	0.090410534	0.330425834	0.025982551	0	0	0	0	0
	2019	7	22	12	15	0.374992304	0.099071565	0.086927767	0.344479071	0.026757927	0	0	0	0	0
	2019	7	22	13	15	0.317268814	0.082747402	0.078686524	0.362270412	0.024917471	0	0	0	0	0
	2019	7	22	14	15	0.324606218	0.092950806	0.082666897	0.371464744	0.030321496	0	0	0	0	0
	2019	7	22	15	15	0.26411553	0.072779356	0.067137162	0.305276642	0.02490175	0	0	0	0	0
	2019	7	22	16	15	0.266858516	0.075860898	0.068931486	0.315815917	0.024515339	0	0	0	0	0
	2019	7	22	17	15	0.246273349	0.066578407	0.059738417	0.267925831	0.023671615	0	0	0	0	0
	2019	7	22	18	15	0.206583182	0.047815652	0.046491162	0.199206549	0.0173668	0	0	0	0	0
	2019	7	22	19	15	0.167817225	0.032514816	0.034331628	0.14656352	0.013599286	0	0	0	0	0
	2019	7	22	20	15	0.130024784	0.023223592	0.026164056	0.101630655	0.008201564	0	0	0	0	0
	2019	7	22	21	15	0.09941435	0.016458836	0.017570279	0.058746285	0.005043574	0	0	0	0	0
	2019	7	22	22	15	0.084725513	0.013484802	0.013988348	0.043584175	0.00405967	0	0	0	0	0
	2019	7	22	23	15	0.076257063	0.011531973	0.012403493	0.037458589	0.003316462	0	0	0	0	0
7/23/19	2019	7	23	0	15	0.069039044	0.010316226	0.011778963	0.033697834	0.003138023	4.479019578	1.045033833	0.987066702	3.491410786	0.315014748
	2019	7	23	1	15	0.063619705	0.009353178	0.010689333	0.030709596	0.003041186	0	0	0	0	0
	2019	7	23	2	15	0.06009241	0.008664954	0.010636004	0.029651906	0.002731208	0	0	0	0	0
	2019	7	23	3	15	0.057699554	0.008286883	0.010156873	0.027716907	0.002557636	0	0	0	0	0
	2019	7	23	4	15	0.057453785	0.007818108	0.00957633	0.024570145	0.002497766	0	0	0	0	0
	2019	7	23	5	15	0.055639574	0.007688063	0.009741179	0.022916798	0.002368897	0	0	0	0	0
	2019	7	23	6	15	0.055838985	0.00771078	0.010950271	0.073867217	0.002415019	0	0	0	0	0
	2019	7	23	7	15	0.128278927	0.02512274	0.035570163	0.099036204	0.008248861	0	0	0	0	0
	2019	7	23	8	15	0.260092929	0.048804862	0.058107086	0.144426746	0.014269346	0	0	0	0	0
	2019	7	23	9	15	0.342677143	0.074419208	0.074658652	0.203639796	0.021033478	0	0	0	0	0
	2019	7	23	10	15	0.368042526	0.094212865	0.08667725	0.237914396	0.024436754	0	0	0	0	0
	2019	7	23	11	15	0.380079686	0.10042078	0.089610199	0.263851075	0.026008859	0	0	0	0	0
	2019	7	23	12	15	0.359583344	0.097144699	0.086467305	0.280913797	0.027840604	0	0	0	0	0
	2019	7	23	13	15	0.33261818	0.093211871	0.082230956	0.299170647	0.02749989	0	0	0	0	0
	2019	7	23	14	15	0.308321074	0.088672962	0.0785549	0.294298926	0.028260005	0	0	0	0	0
	2019	7	23	15	15	0.263720523	0.081539547	0.068457163	0.274159806	0.025282369	0	0	0	0	0
	2019	7	23	16	15	0.282510583	0.075502913	0.06192325	0.260698126	0.025420463	0	0	0	0	0
	2019	7	23	17	15	0.227646861	0.055279546	0.053385669	0.227776683	0.017439687	0	0	0	0	0
	2019	7	23	18	15	0.224953134	0.051049485	0.042901578	0.205277581	0.017912957	0	0	0	0	0
	2019	7	23	19	15	0.184275456	0.034200921	0.030618159	0.174904393	0.012109723	0	0	0	0	0
	2019	7	23	20	15	0.134850783	0.023523558	0.022562106	0.152384732	0.008027159	0	0	0	0	0
	2019	7	23	21	15	0.101904633	0.016902935	0.016378737	0.053554133	0.005032659	0	0	0	0	0
	2019	7	23	22	15	0.085463083	0.0137882	0.013359921	0.040133707	0.00402542	0	0	0	0	0
	2019	7	23	23	15	0.074617656	0.011398549	0.012074655	0.036139635	0.003416779	0	0	0	0	0
7/24/19	2019	7	24	0	15	0.066974307	0.010201358	0.010986793	0.031956382	0.003003576	4.297051029	1.024617653	0.990682433	4.243936458	0.314305176
	2019	7	24	1	15	0.062236845	0.009294155	0.010185388	0.028875185	0.002731837	0	0	0	0	0
	2019	7	24	2	15	0.058643105	0.008312015	0.009606358	0.02617127	0.002515157	0	0	0	0	0
	2019	7	24	3	15	0.055847309	0.00780353	0.009558243	0.022980474	0.002341316	0	0	0	0	0
	2019	7	24	4	15	0.052520281	0.00745792	0.009215276	0.021019374	0.002064394	0	0	0	0	0
	2019	7	24	5	15	0.051987612	0.006995458	0.008880009	0.022001914	0.002224984	0	0	0	0	0
	2019	7	24	6	15	0.053225848	0.007183264	0.009929617	0.158487163	0.002373402	0	0	0	0	0
	2019	7	24	7	15	0.127977791	0.02509807	0.034998997	0.191775406	0.008608269	0	0	0	0	0
	2019	7	24	8	15	0.234578569	0.043944745	0.055407652	0.240132681	0.016117341	0	0	0	0	0
	2019	7	24	9	15	0.328758756	0.074765823	0.078026274	0.304870103	0.024223382	0	0	0	0	0
	2019	7	24	10	15	0.342733613	0.084293387	0.082054254	0.328580656	0.025330821	0	0	0	0	0
	2019	7	24	11	15	0.3702103	0.100630768	0.086320839	0.35415681	0.025336953	0	0	0	0	0
	2019	7	24	12	15	0.338217328	0.086788351	0.079957448	0.345778333	0.024483955	0	0	0	0	0
	2019	7	24	13	15	0.314884384	0.0966248	0.08307878	0.374419343	0.027030085	0	0	0	0	0
	2019	7	24	14	15	0.320880035	0.090881405	0.082694293	0.360660967	0.027925317	0	0	0	0	0
	2019	7	24	15	15	0.284109559	0.081848232	0.076061126	0.342064319	0.025707143	0	0	0	0	0
	2019	7	24	16	15	0.250639256	0.071958757	0.069415336	0.307824259	0.023453616	0	0	0	0	0
	2019	7	24	17	15	0.246480587	0.070184745	0.060875468	0.266578276	0.02104185	0	0	0	0	0
	2019	7	24	18	15	0.221882023	0.05235003	0.045715487	0.205752329	0.018493846	0	0	0	0	0
	2019	7	24	19	15	0.172923843	0.032594238	0.032889746	0.142468703	0.012402983	0	0	0	0	0
	2019	7	24	20	15	0.112265293	0.020514687	0.019954222	0.071641558	0.006582446	0	0	0	0	0
	2019	7	24	21	15	0.088825095	0.014105393	0.013494372	0.039683148	0.003937881	0	0	0	0	0
	2019	7	24	22	15	0.074659338	0.011282416	0.011119232	0.030132522	0.003298037	0	0	0	0	0
	2019	7	24	23	15	0.065589952	0.009504106	0.010257223	0.025925283	0.003076585	0	0	0	0	0
7/25/19	2019	7	25	0	15	0.05905619	0.008233162	0.009532527	0.023361179	0.00279341	3.766431725	0.874530982	0.864932254	3.51813337	0.274337101
	2019	7	25	1	15	0.054035966	0.007233822	0.008732608	0.020656624	0.002672704	0	0	0	0	0
	2019	7	25	2	15	0.050694234	0.00679541	0.008406479	0.018184312	0.002491975	0	0	0	0	0
	2019	7	25	3	15	0.048624477	0.006192884	0.007888498	0.016417964	0.002411718	0	0	0	0	0
	2019	7	25	4	15	0.046185	0.005715099	0.007541356	0.013748634	0.002463471	0	0	0	0	0
	2019	7	25	5	15	0.044039444	0.005268749	0.007132768	0.012215868	0.002072579	0	0	0	0	0
	2019	7	25	6	15	0.042207511	0.004947506	0.007355302	0.077221929	0.002177762	0	0	0	0	0
	2019	7	25	7	15	0.087692433	0.014746769	0.018345694	0.086565198	0.005485428	0	0	0	0	0
	2019	7	25	8	15	0.151671899	0.026452487	0.032870096	0.109075914	0.008916488	0	0	0	0	0
	2019	7	25	9	15	0.22067451	0.049448295	0.052632368	0.15775152	0.016522455	0	0	0	0	0
	2019	7	25	10	15	0.308563184	0.062214688	0.063585285	0.21988544	0.018729873	0	0	0	0	0
	2019	7	25	11	15	0.333497816	0.075726327	0.07061433	0.276205108	0.020384188	0	0	0	0	0
	2019	7	25	12	15	0.324331632	0.083184134	0.076237666	0.32626212	0.024089518	0	0	0	0	0
	2019	7	25	13	15	0.299010638	0.083334916	0.077235416	0.346707059	0.026706616	0	0	0	0	0
	2019	7	25	14	15	0.270967839	0.073861586	0.07094304	0.319642619	0.022398464	0	0	0	0	0
	2019	7	25	15	15	0.248649493	0.071444	0.067690166	0.301197314	0.021499239	0	0	0	0	0
	2019	7	25	16	15	0.259891709	0.0812446	0.071713307	0.331034537	0.02470995	0	0	0	0	0
	2019	7	25	17	15	0.231486059	0.066697548	0.059715397	0.275921599	0.020792027	0	0	0	0	0
	2019	7	25	18	15	0.195642771	0.0490599	0.048167548	0.217476216	0.017067145	0	0	0	0	0
	2019	7	25	19	15	0.157798506	0.033852665	0.03454129	0.159295292	0.01223263	0	0	0	0	0
	2019	7	25	20	15	0.109967893	0.021396957	0.023323754	0.091625831	0.006701414	0	0	0	0	0
	2019	7	25	21	15	0.084776621	0.015011882	0.015527454	0.048364371	0.004282489	0	0	0	0	0
	2019	7	25	22	15	0.072277969	0.012133201	0.013241933	0.036662415	0.003539877	0	0	0	0	0
	2019	7	25	23	15	0.064687931	0.010334395	0.011957972	0.032654307	0.003195681	0	0	0	0	0
7/26/19	2019	7	26	0	15	0.058189725	0.009037783	0.010852996	0.028015333	0.002840303	3.090807784	0.731939314	0.775096157	3.10300412	0.230015082
	2019	7	26	1	15	0.052956145	0.008350961	0.010359291	0.025861256	0.002854091	0	0	0	0	0
	2019	7	26	2	15	0.049467875	0.007199535	0.009162531	0.022404203	0.002324173	0	0	0	0	0
	2019	7	26	3	15	0.0468471	0.006623964	0.008821941	0.02093188	0.002340067	0	0	0	0	0
	2019	7	26	4	15	0.043726839	0.005947519	0.008000971	0.017947728	0.00194983	0	0	0	0	0
	2019	7	26	5	15	0.042823781	0.005251386	0.007366597	0.016366157	0.001988385	0	0	0	0	0
	2019	7	26	6	15	0.041242846	0.005383333	0.008474465	0.018795166	0.002038168	0	0	0	0	0
	2019	7	26	7	15	0.046490688	0.007228938	0.011504736	0.026225379	0.003070769	0	0	0	0	0
	2019	7	26	8	15	0.060235696	0.012241385	0.017347527	0.062267739	0.005486081	0	0	0	0	0
	2019	7	26	9	15	0.130710871	0.031429021	0.035936055	0.15034569	0.011453493	0	0	0	0	0
	2019	7	26	10	15	0.305261128	0.073042275	0.074855285	0.277862735	0.020731438	0	0	0	0	0
	2019	7	26	11	15	0.322613213	0.081023204	0.078346868	0.30788677	0.023861214	0	0	0	0	0
	2019	7	26	12	15	0.268086016	0.066707189	0.064505777	0.272202006	0.018123029	0	0	0	0	0
	2019	7	26	13	15	0.274752257	0.076048591	0.071342394	0.315624185	0.025314995	0	0	0	0	0
	2019	7	26	14	15	0.180884924	0.048264442	0.047611045	0.215575757	0.014124786	0	0	0	0	0
	2019	7	26	15	15	0.189795014	0.055037684	0.055256734	0.249210504	0.016671121	0	0	0	0	0
	2019	7	26	16	15	0.175176217	0.047037605	0.050003195	0.232222476	0.01307709	0	0	0	0	0
	2019	7	26	17	15	0.201446406	0.05603882	0.054123194	0.2397427	0.016552372	0	0	0	0	0
	2019	7	26	18	15	0.155965049	0.043066392	0.044752284	0.210329753	0.016105833	0	0	0	0	0
	2019	7	26	19	15	0.133935755	0.031575213	0.038443908	0.175044932	0.012198351	0	0	0	0	0
	2019	7	26	20	15	0.107740091	0.020627937	0.025518195	0.100023729	0.006493249	0	0	0	0	0
	2019	7	26	21	15	0.079954573	0.01436262	0.018115413	0.054928068	0.004203797	0	0	0	0	0
	2019	7	26	22	15	0.06663652	0.01159392	0.013658045	0.037032458	0.003437463	0	0	0	0	0
	2019	7	26	23	15	0.055869055	0.008819597	0.01073671	0.026157516	0.002774984	0	0	0	0	0
7/27/19	2019	7	27	0	15	0.049387802	0.006984858	0.009682896	0.021635155	0.002416856	3.331074867	0.792970469	0.79643038	3.189140782	0.248139268
	2019	7	27	1	15	0.046017371	0.006382392	0.00877149	0.018496541	0.002226104	0	0	0	0	0
	2019	7	27	2	15	0.042666744	0.005824232	0.008305404	0.016549529	0.002161335	0	0	0	0	0
	2019	7	27	3	15	0.039488802	0.004826323	0.007290032	0.012571857	0.001900974	0	0	0	0	0
	2019	7	27	4	15	0.03903657	0.00492776	0.007164034	0.012775117	0.001843299	0	0	0	0	0
	2019	7	27	5	15	0.037185225	0.004227037	0.0066376	0.009493651	0.001831418	0	0	0	0	0
	2019	7	27	6	15	0.036155272	0.003908864	0.006317093	0.091884622	0.002069395	0	0	0	0	0
	2019	7	27	7	15	0.047621887	0.007450483	0.014480045	0.099573412	0.004530367	0	0	0	0	0
	2019	7	27	8	15	0.095314849	0.025439265	0.034742654	0.128262868	0.011093142	0	0	0	0	0
	2019	7	27	9	15	0.196613096	0.042169765	0.050314899	0.182741027	0.016037444	0	0	0	0	0
	2019	7	27	10	15	0.312387946	0.070685961	0.072035927	0.280649826	0.020726309	0	0	0	0	0
	2019	7	27	11	15	0.353321688	0.086594929	0.079802842	0.335579806	0.024162524	0	0	0	0	0
	2019	7	27	12	15	0.349676851	0.096526276	0.087258033	0.340020412	0.027925079	0	0	0	0	0
	2019	7	27	13	15	0.324004567	0.089412368	0.079126208	0.337413462	0.02627173	0	0	0	0	0
	2019	7	27	14	15	0.269353653	0.077014616	0.070744496	0.312754922	0.021533318	0	0	0	0	0
	2019	7	27	15	15	0.15496309	0.035113677	0.029798924	0.117476744	0.007279188	0	0	0	0	0
	2019	7	27	16	15	0.167258205	0.047228614	0.046209466	0.14797809	0.011299514	0	0	0	0	0
	2019	7	27	17	15	0.157520267	0.046147793	0.045591219	0.202988927	0.016360669	0	0	0	0	0
	2019	7	27	18	15	0.147239997	0.042772916	0.039179405	0.190988767	0.016792934	0	0	0	0	0
	2019	7	27	19	15	0.147652946	0.032616929	0.031959637	0.148899628	0.012447615	0	0	0	0	0
	2019	7	27	20	15	0.114648425	0.021553506	0.022106359	0.079467822	0.006714021	0	0	0	0	0
	2019	7	27	21	15	0.08213217	0.014498649	0.015526883	0.043733954	0.004185802	0	0	0	0	0
	2019	7	27	22	15	0.064778443	0.011370278	0.012611398	0.031465344	0.00334578	0	0	0	0	0
	2019	7	27	23	15	0.056649001	0.009292978	0.010773436	0.025739299	0.002984451	0	0	0	0	0
7/28/19	2019	7	28	0	15	0.051884047	0.008051848	0.010280562	0.023328351	0.002960708	3.592484206	0.875788962	0.818119049	2.805543435	0.262808474
	2019	7	28	1	15	0.04697328	0.007187536	0.009320901	0.019543636	0.002545646	0	0	0	0	0
	2019	7	28	2	15	0.043283527	0.00607528	0.008317276	0.016451408	0.002164729	0	0	0	0	0
	2019	7	28	3	15	0.040780593	0.005629166	0.007761838	0.014048331	0.002194156	0	0	0	0	0
	2019	7	28	4	15	0.038780448	0.004926215	0.007466522	0.012182128	0.002001834	0	0	0	0	0
	2019	7	28	5	15	0.036982186	0.004790304	0.006680655	0.0104769	0.001895015	0	0	0	0	0
	2019	7	28	6	15	0.035847405	0.004044442	0.006472941	0.041982516	0.001872412	0	0	0	0	0
	2019	7	28	7	15	0.034770892	0.003557807	0.006022604	0.044003936	0.001261501	0	0	0	0	0
	2019	7	28	8	15	0.07212288	0.00821139	0.015522959	0.062764191	0.003771111	0	0	0	0	0
	2019	7	28	9	15	0.203013931	0.039566969	0.044458936	0.123177944	0.010778122	0	0	0	0	0
	2019	7	28	10	15	0.332913131	0.081172982	0.078396125	0.218882662	0.020949789	0	0	0	0	0
	2019	7	28	11	15	0.364242123	0.093673219	0.085291966	0.251089637	0.025047867	0	0	0	0	0
	2019	7	28	12	15	0.353101741	0.090904458	0.083710087	0.260688666	0.024333106	0	0	0	0	0
	2019	7	28	13	15	0.31185503	0.087385354	0.075775534	0.252503737	0.023834227	0	0	0	0	0
	2019	7	28	14	15	0.271735803	0.08196253	0.067886159	0.243072129	0.023805925	0	0	0	0	0
	2019	7	28	15	15	0.234579585	0.079467041	0.065131882	0.238313353	0.023297256	0	0	0	0	0
	2019	7	28	16	15	0.224292929	0.072633311	0.058122344	0.218923647	0.021282805	0	0	0	0	0
	2019	7	28	17	15	0.199354245	0.060051303	0.048119916	0.194400031	0.018783439	0	0	0	0	0
	2019	7	28	18	15	0.19388116	0.045088917	0.037568721	0.170622892	0.017264922	0	0	0	0	0
	2019	7	28	19	15	0.164744629	0.029718571	0.030061751	0.145997968	0.012824413	0	0	0	0	0
	2019	7	28	20	15	0.1132624	0.021682824	0.023727131	0.128554756	0.007989258	0	0	0	0	0
	2019	7	28	21	15	0.086212546	0.015891646	0.016249189	0.047002237	0.004667916	0	0	0	0	0
	2019	7	28	22	15	0.072526203	0.013160855	0.013703937	0.036424478	0.003915983	0	0	0	0	0
	2019	7	28	23	15	0.065343492	0.010954994	0.012069113	0.031107901	0.003366334	0	0	0	0	0
